Title,EpisodeDuration(in Minutes),Genres,Actors,Rating,Votes,Updated Years
The Family Man,42,"Action, Comedy, Drama","Manoj Bajpayee, Samantha Akkineni, Priyamani, Sharib Hashmi",8.8,57632,2019
Lucifer,45,"Crime, Drama, Fantasy","Tom Ellis, Lauren German, Lesley-Ann Brandt, Kevin Alejandro",8.1,252826,2016
The Handmaid's Tale,42,"Drama, Sci-Fi, Thriller","Elisabeth Moss, Yvonne Strahovski, Joseph Fiennes, Ann Dowd",8.4,187007,2017
StartUp,60,"Crime, Thriller","Adam Brody, Edi Gathegi, Otmara Marrero, Kristen Ariza",8,18165,2016
Game of Thrones,44,"Action, Adventure, Drama","Emilia Clarke, Peter Dinklage, Kit Harington, Lena Headey",9.3,1823966,2011
The Kominsky Method,57,"Comedy, Drama","Michael Douglas, Sarah Baker, Graham Rogers, Melissa Tang",8.2,29990,2018
Grey's Anatomy,30,"Drama, Romance","Ellen Pompeo, Chandra Wilson, James Pickens Jr., Justin Chambers",7.5,261340,2005
The Blacklist,41,"Crime, Drama, Mystery","James Spader, Megan Boone, Diego Klattenhoff, Ryan Eggold",8,207764,2013
Dirty John,43,"Crime, Drama","Connie Britton, Christian Slater, Eric Bana, Amanda Peet",7.2,16959,2018
The Walking Dead,44,"Drama, Horror, Thriller","Andrew Lincoln, Norman Reedus, Melissa McBride, Lauren Cohan",8.2,874725,2010
Breaking Bad,44,"Crime, Drama, Thriller","Bryan Cranston, Aaron Paul, Anna Gunn, Betsy Brandt",9.4,1526926,2008
Peaky Blinders,49,"Crime, Drama","Cillian Murphy, Paul Anderson, Helen McCrory, Sophie Rundle",8.8,380395,2013
The Boys,60,"Action, Comedy, Crime","Karl Urban, Jack Quaid, Antony Starr, Erin Moriarty",8.7,279838,2019
The Office,60,Comedy,"Steve Carell, Jenna Fischer, John Krasinski, Rainn Wilson",8.9,441951,2005
Vikings,22,"Action, Adventure, Drama","Katheryn Winnick, Gustaf Skarsgård, Alexander Ludwig, Georgia Hirst",8.5,451657,2013
Criminal Minds,44,"Crime, Drama, Mystery","Matthew Gray Gubler, Kirsten Vangsness, A.J. Cook, Joe Mantegna",8,167842,2005
Manifest,42,"Drama, Mystery, Sci-Fi","Melissa Roxburgh, Josh Dallas, Athena Karkanis, J.R. Ramirez",7.2,25510,2018
Yellowstone,43,"Drama, Western","Kevin Costner, Luke Grimes, Kelly Reilly, Wes Bentley",8.6,37622,2018
Stranger Things,60,"Drama, Fantasy, Horror","Millie Bobby Brown, Finn Wolfhard, Winona Ryder, David Harbour",8.7,864302,2016
Why Women Kill,51,"Comedy, Crime, Drama","Jack Davenport, Lucy Liu, Ginnifer Goodwin, Kirby Howell-Baptiste",8.4,13611,2019
The Flash,43,"Action, Adventure, Drama","Grant Gustin, Candice Patton, Danielle Panabaker, Carlos Valdes",7.6,314534,2014
Supernatural,44,"Drama, Fantasy, Horror","Jared Padalecki, Jensen Ackles, Jim Beaver, Misha Collins",8.4,399980,2005
NCIS: Naval Criminal Investigative Service,60,"Action, Crime, Drama","Mark Harmon, David McCallum, Sean Murray, Pauley Perrette",7.7,123556,2003
The Good Doctor,41,Drama,"Freddie Highmore, Hill Harper, Richard Schiff, Antonia Thomas",8.1,67670,2017
Line of Duty,60,"Crime, Drama, Mystery","Martin Compston, Vicky McClure, Adrian Dunbar, Craig Parkinson",8.7,44376,2012
Fear the Walking Dead,44,"Drama, Horror, Sci-Fi","Kim Dickens, Frank Dillane, Cliff Curtis, Rubén Blades",6.9,116481,2015
Downton Abbey,58,"Drama, Romance","Hugh Bonneville, Phyllis Logan, Elizabeth McGovern, Brendan Coyle",8.7,168268,2010
Modern Family,22,"Comedy, Drama, Romance","""Ed ONeill"", Sofía Vergara, Julie Bowen, Ty Burrell",8.4,371124,2009
La casa de papel,70,"Action, Crime, Mystery","Úrsula Corberó, Álvaro Morte, Itziar Ituño, Pedro Alonso",8.3,331408,2017
Schitt's Creek,22,Comedy,"Eugene Levy, ""Catherine OHara"", Dan Levy, Annie Murphy",8.5,84920,2015
Outlander,64,"Drama, Fantasy, Romance","Caitriona Balfe, Sam Heughan, Duncan Lacroix, Sophie Skelton",8.4,132737,2014
Shingeki no kyojin,24,"Animation, Action, Adventure","Yûki Kaji, Marina Inoue, Josh Grelle, Yui Ishikawa",9,234234,2013
War of the Worlds,49,"Drama, Mystery, Sci-Fi","Léa Drucker, Daisy Edgar-Jones, Natasha Little, Gabriel Byrne",6.3,8526,2019
The Big Bang Theory,22,"Comedy, Romance","Johnny Galecki, Jim Parsons, Kaley Cuoco, Simon Helberg",8.1,737437,2007
Younger,22,"Comedy, Romance","Sutton Foster, Hilary Duff, Debi Mazar, Nico Tortorella",7.8,19431,2015
Dexter,53,"Crime, Drama, Mystery","Michael C. Hall, Jennifer Carpenter, David Zayas, James Remar",8.6,658516,2006
New Amsterdam,43,Drama,"Ryan Eggold, Janet Montgomery, Freema Agyeman, Jocko Sims",8.1,26041,2018
Brooklyn Nine-Nine,22,"Comedy, Crime","Andy Samberg, Stephanie Beatriz, Terry Crews, Melissa Fumero",8.4,242429,2013
Fargo,53,"Crime, Drama, Thriller","Billy Bob Thornton, Martin Freeman, Allison Tolman, Colin Hanks",8.9,337527,2014
The Mandalorian,40,"Action, Adventure, Sci-Fi","Pedro Pascal, Gina Carano, Giancarlo Esposito, Chris Bartlett",8.8,325891,2019
Better Call Saul,46,"Crime, Drama","Bob Odenkirk, Rhea Seehorn, Jonathan Banks, Patrick Fabian",8.7,341222,2015
This Is Us,45,"Comedy, Drama, Romance","Milo Ventimiglia, Mandy Moore, Sterling K. Brown, Chrissy Metz",8.7,114515,2016
Rick and Morty,23,"Animation, Adventure, Comedy","Justin Roiland, Chris Parnell, Spencer Grammer, Sarah Chalke",9.2,395283,2013
Queen of the South,42,"Action, Crime, Drama","Alice Braga, Hemky Madera, Peter Gadiot, Veronica Falcón",7.9,22064,2016
American Horror Story,60,"Drama, Horror, Thriller","Lady Gaga, Kathy Bates, Angela Bassett, Sarah Paulson",8,282563,2011
"Love, Death & Robots",15,"Animation, Short, Comedy","Scott Whyte, Nolan North, Steven Pacey, ""Emily OBrien""",8.5,116592,2019
Black Mirror,60,"Drama, Sci-Fi, Thriller","Daniel Lapaine, Hannah John-Kamen, Michaela Coel, Beatrice Robertson-Jones",8.8,462587,2011
The Witcher,60,"Action, Adventure, Fantasy","Henry Cavill, Anna Shaffer, Freya Allan, Yasen Atour",8.2,321466,2019
The Crown,58,"Biography, Drama, History","Claire Foy, Olivia Colman, Imelda Staunton, Matt Smith",8.6,166196,2016
Lost,44,"Adventure, Drama, Fantasy","Jorge Garcia, Josh Holloway, Yunjin Kim, Evangeline Lilly",8.3,507182,2004
It's Always Sunny in Philadelphia,22,Comedy,"Charlie Day, Glenn Howerton, Rob McElhenney, Kaitlin Olson",8.8,195045,2005
Kim's Convenience,22,Comedy,"Paul Sun-Hyung Lee, Jean Yoon, Andrea Bang, Simu Liu",8.2,11076,2016
Shameless,46,"Comedy, Drama","Emmy Rossum, William H. Macy, Ethan Cutkosky, Jeremy Allen White",8.5,211076,2011
S.W.A.T.,43,"Action, Adventure, Crime","Shemar Moore, Alex Russell, Lina Esco, Kenny Johnson",7,15999,2017
How I Met Your Mother,22,"Comedy, Romance","Josh Radnor, Jason Segel, Cobie Smulders, Neil Patrick Harris",8.3,618121,2005
Pose,60,Drama,"Mj Rodriguez, Dominique Jackson, Indya Moore, Angel Bismark Curiel",8.6,22037,2018
New Girl,22,Comedy,"Zooey Deschanel, Jake Johnson, Max Greenfield, Hannah Simone",7.7,198036,2011
See,60,"Action, Drama, Sci-Fi","Jason Momoa, Sylvia Hoeks, Hera Hilmar, Christian Camargo",7.6,45777,2019
Ozark,60,"Crime, Drama, Thriller","Jason Bateman, Laura Linney, Sofia Hublitz, Skylar Gaertner",8.4,200966,2017
The 100,43,"Drama, Mystery, Sci-Fi","Eliza Taylor, Bob Morley, Marie Avgeropoulos, Isaiah Washington",7.6,224132,2014
Doctor Who,45,"Adventure, Drama, Family","Jodie Whittaker, Peter Capaldi, Pearl Mackie, Matt Smith",8.6,202938,2005
Westworld,62,"Drama, Mystery, Sci-Fi","Evan Rachel Wood, Jeffrey Wright, Ed Harris, Thandiwe Newton",8.6,439841,2016
The Vampire Diaries,43,"Drama, Fantasy, Horror","Nina Dobrev, Paul Wesley, Ian Somerhalder, Kat Graham",7.7,290496,2009
The Wire,59,"Crime, Drama, Thriller","Dominic West, Lance Reddick, Sonja Sohn, Wendell Pierce",9.3,294150,2002
A Million Little Things,43,"Comedy, Drama, Romance","David Giuntoli, Romany Malco, Allison Miller, Christina Moses",7.9,9562,2018
The Last Kingdom,60,"Action, Drama, History","Alexander Dreymon, Eliza Butterworth, Arnas Fedaravicius, Millie Brady",8.4,91987,2015
Sons of Anarchy,45,"Crime, Drama, Thriller","Charlie Hunnam, Katey Sagal, Mark Boone Junior, Kim Coates",8.5,267551,2008
Bones,40,"Comedy, Crime, Drama","Emily Deschanel, David Boreanaz, Michaela Conlin, T.J. Thyne",7.8,142888,2005
Bosch,51,"Crime, Drama","Titus Welliver, Jamie Hector, Amy Aquino, Lance Reddick",8.4,49704,2014
Chicago Fire,43,"Action, Drama","Jesse Spencer, Taylor Kinney, Christian Stolte, Eamonn Walker",8,41221,2012
True Detective,55,"Crime, Drama, Mystery","Vince Vaughn, Colin Farrell, Rachel McAdams, Taylor Kitsch",8.9,510795,2014
Community,22,Comedy,"Joel McHale, Danny Pudi, Donald Glover, Chevy Chase",8.5,227366,2009
Castlevania,23,"Animation, Action, Adventure","Richard Armitage, James Callis, Alejandra Reynoso, Theo James",8.3,48905,2017
Master of None,30,"Comedy, Drama","Aziz Ansari, Eric Wareheim, Lena Waithe, Noël Wells",8.3,69540,2015
House M.D.,44,"Drama, Mystery","Hugh Laurie, Omar Epps, Robert Sean Leonard, Jesse Spencer",8.7,422601,2004
Sex Education,45,"Comedy, Drama","Asa Butterfield, Gillian Anderson, Ncuti Gatwa, Emma Mackey",8.3,171342,2019
The Bold Type,45,"Comedy, Drama","Katie Stevens, Aisha Dee, Meghann Fahy, Melora Hardin",7.9,14758,2017
Superstore,22,Comedy,"Ben Feldman, Lauren Ash, Colton Dunn, Nico Santos",7.8,34013,2015
The Expanse,60,"Drama, Mystery, Sci-Fi","Wes Chatham, Dominique Tipper, Steven Strait, Shohreh Aghdashloo",8.5,117294,2015
The Rookie,43,"Comedy, Crime, Drama","Nathan Fillion, Alyssa Diaz, Richard T. Jones, Titus Makin Jr.",8,23655,2018
Suits,44,"Comedy, Drama","Gabriel Macht, Patrick J. Adams, Meghan Markle, Sarah Rafferty",8.4,371333,2011
Parks and Recreation,22,Comedy,"Amy Poehler, ""Jim OHeir"", Nick Offerman, Chris Pratt",8.6,223130,2009
Cobra Kai,30,"Action, Comedy, Drama","Ralph Macchio, Xolo Maridueña, William Zabka, Courtney Henggeler",8.6,119611,2018
Legends of Tomorrow,42,"Action, Adventure, Drama","Caity Lotz, Amy Louise Pemberton, Dominic Purcell, Brandon Routh",6.8,94463,2016
9/1/01,43,"Action, Drama, Thriller","Angela Bassett, Peter Krause, Oliver Stark, Aisha Hinds",7.7,24353,2018
Heartland,45,"Drama, Family","Amber Marshall, Shaun Johnston, Michelle Morgan, Graham Wardle",8.4,10864,II 2
Broken But Beautiful,22,"Drama, Romance","Vikrant Massey, Harleen Sethi, Jitin Gulati, Pooja Bhamrrah",9.2,11744,2018
Mad Men,47,Drama,"Jon Hamm, Elisabeth Moss, Vincent Kartheiser, January Jones",8.6,213620,2007
Boku no hîrô akademia,24,"Animation, Action, Adventure","Daiki Yamashita, Nobuhiko Okamoto, Ayane Sakura, Kaito Ishikawa",8.5,41896,2016
Dark,60,"Crime, Drama, Mystery","Louis Hofmann, Karoline Eichhorn, Lisa Vicari, Maja Schöne",8.8,305353,2017
Chicago P.D.,43,"Action, Crime, Drama","Jason Beghe, Jesse Lee Soffer, Patrick John Flueger, Marina Squerciati",8.1,29871,2014
Euphoria,55,Drama,"Zendaya, Hunter Schafer, Jacob Elordi, Maude Apatow",8.4,71996,2019
Homeland,55,"Crime, Drama, Mystery","Claire Danes, Mandy Patinkin, Damian Lewis, Rupert Friend",8.3,320237,2011
BoJack Horseman,25,"Animation, Comedy, Drama","Will Arnett, Amy Sedaris, Alison Brie, Aaron Paul",8.7,120871,2014
Prison Break,44,"Action, Crime, Drama","Dominic Purcell, Wentworth Miller, Amaury Nolasco, Robert Knepper",8.3,487718,2005
Succession,60,Drama,"Nicholas Braun, Sarah Snook, Jeremy Strong, Brian Cox",8.6,53113,2018
Riverdale,45,"Crime, Drama, Mystery","K.J. Apa, Lili Reinhart, Camila Mendes, Cole Sprouse",6.8,125092,2017
Hawaii Five-0,42,"Action, Crime, Drama","""Alex OLoughlin"", Scott Caan, Taylor Wily, Daniel Dae Kim",7.3,68008,2010
SEAL Team,43,"Action, Drama, War","David Boreanaz, Max Thieriot, Neil Brown Jr., A.J. Buckley",7.6,17734,2017
Billions,60,Drama,"Paul Giamatti, Damian Lewis, Maggie Siff, David Costabile",8.4,72721,2016
Agents of S.H.I.E.L.D.,45,"Action, Adventure, Drama","Clark Gregg, Ming-Na Wen, Brett Dalton, Iain De Caestecker",7.5,203586,2013
Good Girls,43,"Comedy, Crime, Drama","Christina Hendricks, Retta, Mae Whitman, Reno Wilson",7.8,37034,2018
Call the Midwife,60,"Drama, History","Vanessa Redgrave, Laura Main, Jenny Agutter, Stephen McGann",8.4,21074,2012
Legacies,45,"Adventure, Drama, Fantasy","Danielle Rose Russell, Aria Shahghasemi, Kaylee Bryant, Quincy Fouse",7.4,21513,2018
Teen Wolf,41,"Action, Drama, Fantasy","Tyler Posey, Holland Roden, ""Dylan OBrien"", Linden Ashby",7.6,131103,2011
Mr Inbetween,30,"Crime, Drama","Scott Ryan, Chika Yasumura, Justin Rosniak, Damon Herriman",8.5,7208,2018
Arrow,42,"Action, Adventure, Crime","Stephen Amell, Katie Cassidy, David Ramsey, Susanna Thompson",7.5,412385,2012
Titans,45,"Action, Adventure, Crime","Brenton Thwaites, Teagan Croft, Anna Diop, Ryan Potter",7.7,70823,I 20
For All Mankind,60,"Drama, Sci-Fi","Joel Kinnaman, Michael Dorman, Sarah Jones, Shantel VanSanten",7.8,20425,2019
Station 19,60,"Action, Drama, Romance","Jaina Lee Ortiz, Jason George, Grey Damon, Barrett Doss",6.7,9717,2018
Scrubs,22,"Comedy, Drama","Zach Braff, Donald Faison, Sarah Chalke, John C. McGinley",8.3,240695,2001
The Morning Show,60,Drama,"Jennifer Aniston, Reese Witherspoon, Billy Crudup, Gugu Mbatha-Raw",8.4,59315,I 20
Two and a Half Men,22,"Comedy, Romance","Jon Cryer, Ashton Kutcher, Angus T. Jones, Conchata Ferrell",7,245102,2003
Star Wars: The Clone Wars,23,"Animation, Action, Adventure","Tom Kane, Dee Bradley Baker, Matt Lanter, James Arnold Taylor",8.3,69586,2008
Once Upon a Time,60,"Adventure, Fantasy, Romance","Ginnifer Goodwin, Jennifer Morrison, Lana Parrilla, Robert Carlyle",7.7,211260,2011
Happy Endings,22,"Comedy, Romance","Eliza Coupe, Elisha Cuthbert, Zachary Knighton, Adam Pally",7.7,34985,2011
Orange Is the New Black,59,"Comedy, Crime, Drama","Taylor Schilling, Danielle Brooks, Taryn Manning, Emma Myles",8,282708,2013
Batwoman,45,"Action, Adventure, Crime","Camrus Johnson, Rachel Skarsten, Meagan Tandy, Nicole Kang",3.4,35252,2019
Killing Eve,42,"Action, Adventure, Drama","Jodie Comer, Sandra Oh, Fiona Shaw, Kim Bodnia",8.2,91713,2018
Mr. Robot,49,"Crime, Drama, Thriller","Rami Malek, Christian Slater, Carly Chaikin, Martin Wallström",8.5,342252,2015
In Treatment,25,Drama,"Gabriel Byrne, Dianne Wiest, Uzo Aduba, Michelle Forbes",8.2,15975,2008
Narcos,49,"Biography, Crime, Drama","Pedro Pascal, Wagner Moura, Boyd Holbrook, Alberto Ammann",8.8,370793,2015
Sherlock,88,"Crime, Drama, Mystery","Benedict Cumberbatch, Martin Freeman, Una Stubbs, Rupert Graves",9.1,830345,2010
Virgin River,44,"Drama, Romance","Alexandra Breckenridge, Martin Henderson, Colin Lawrence, Lauren Hammersley",7.5,22957,2019
The Mentalist,43,"Crime, Drama, Mystery","Simon Baker, Robin Tunney, Tim Kang, Owain Yeoman",8.1,168774,2008
Élite,60,"Crime, Drama, Thriller","Itzan Escamilla, Omar Ayuso, Miguel Bernardeau, Arón Piper",7.5,53781,2018
Arrested Development,22,Comedy,"Jason Bateman, Michael Cera, Portia de Rossi, Will Arnett",8.7,281873,2003
24,44,"Action, Crime, Drama","Kiefer Sutherland, Mary Lynn Rajskub, Carlos Bernard, Dennis Haysbert",8.3,174994,2001
Supergirl,43,"Action, Adventure, Drama","Melissa Benoist, Chyler Leigh, David Harewood, Mehcad Brooks",6.2,114304,2015
High School Musical: The Musical - The Series,31,"Comedy, Drama, Musical","Olivia Rodrigo, Joshua Bassett, Matt Cornett, Larry Saperstein",7.3,4349,2019
Death in Paradise,60,"Comedy, Crime, Drama","Elizabeth Bourgine, Danny John-Jules, Don Warrington, Tobi Bakare",7.8,15714,2011
Animal Kingdom,60,"Crime, Drama","Shawn Hatosy, Ben Robson, Jake Weary, Finn Cole",8.2,25295,2016
Mindhunter,60,"Crime, Drama, Thriller","Jonathan Groff, Holt McCallany, Anna Torv, Hannah Gross",8.6,230420,2017
The Sinner,45,"Crime, Drama, Mystery","Bill Pullman, Dohn Norwood, Adam LeFevre, Jessica Biel",7.9,95316,2017
True Blood,55,"Drama, Fantasy, Mystery","Anna Paquin, Stephen Moyer, Sam Trammell, Ryan Kwanten",7.8,231653,2008
Psych,44,"Comedy, Crime, Mystery","James Roday Rodriguez, Dulé Hill, Timothy Omundson, Corbin Bernsen",8.3,87200,2006
Jack Ryan,60,"Action, Drama, Thriller","John Krasinski, Wendell Pierce, John Hoogenakker, Abbie Cornish",8.1,95243,2018
Demon Slayer: Kimetsu No Yaiba,25,"Animation, Action, Fantasy","Natsuki Hanae, Zach Aguilar, Abby Trott, Akari Kitô",8.7,41388,2019
Prodigal Son,44,"Crime, Drama, Mystery","Tom Payne, Lou Diamond Phillips, Halston Sage, Aurora Perrineau",7.7,16048,2019
You,45,"Crime, Drama, Romance","Penn Badgley, Victoria Pedretti, Ambyr Childers, Elizabeth Lail",7.7,153731,2018
Blue Bloods,43,"Crime, Drama, Mystery","Donnie Wahlberg, Bridget Moynahan, Will Estes, Len Cariou",7.6,33544,2010
Castle,43,"Comedy, Crime, Drama","Nathan Fillion, Stana Katic, Susan Sullivan, Jon Huertas",8.1,142862,2009
Inside No. 9,30,"Comedy, Drama, Horror","Reece Shearsmith, Steve Pemberton, Derek Jacobi, Rosie Cavaliero",8.5,13578,2014
Spartacus: Blood and Sand,55,"Action, Adventure, Biography","Andy Whitfield, Lucy Lawless, Manu Bennett, Daniel Feuerriegel",8.5,227020,2010
Young Sheldon,30,Comedy,"Iain Armitage, Zoe Perry, Lance Barber, Montana Jordan",7.5,38209,2017
The Good Place,22,"Comedy, Drama, Fantasy","Kristen Bell, William Jackson Harper, Jameela Jamil, ""DArcy Carden""",8.2,123902,2016
A Discovery of Witches,60,"Drama, Fantasy, Romance","Matthew Goode, Teresa Palmer, Valarie Pettiford, Alex Kingston",8,35721,2018
NCIS: Los Angeles,43,"Action, Crime, Drama","""Chris ODonnell"", Daniela Ruah, Barrett Foa, LL Cool J",6.7,49501,2009
Motherland,30,Comedy,"Anna Maxwell Martin, Lucy Punch, Diane Morgan, Paul Ready",7.8,3060,2016
Bob's Burgers,22,"Animation, Comedy","H. Jon Benjamin, Dan Mintz, Eugene Mirman, John Roberts",8.1,68033,2011
Desperate Housewives,45,"Comedy, Drama, Mystery","Teri Hatcher, Felicity Huffman, Marcia Cross, Eva Longoria",7.5,118588,2004
The Girlfriend Experience,27,Drama,"Riley Keough, Paul Sparks, Julia Goldani Telles, Mary Lynn Rajskub",7.1,9443,2016
Avatar: The Last Airbender,23,"Animation, Action, Adventure","Dee Bradley Baker, Zach Tyler, Mae Whitman, Jack De Sena",9.3,260893,2005
Star Trek: Discovery,60,"Action, Adventure, Drama","Sonequa Martin-Green, Doug Jones, Anthony Rapp, Mary Wiseman",7.2,99850,2017
iCarly,30,"Comedy, Family, Romance","Miranda Cosgrove, Jerry Trainor, Jennette McCurdy, Nathan Kress",6.7,34665,2007
NCIS: New Orleans,42,"Crime, Drama, Mystery","Scott Bakula, Rob Kerkovich, CCH Pounder, Daryl Mitchell",6.8,15839,2014
Justified,44,"Action, Crime, Drama","Timothy Olyphant, Nick Searcy, Joelle Carter, Jacob Pitts",8.6,88999,2010
The Marvelous Mrs. Maisel,57,"Comedy, Drama","Rachel Brosnahan, Alex Borstein, Michael Zegen, Marin Hinkle",8.7,85702,2017
City on a Hill,60,"Crime, Drama, Thriller","Kevin Bacon, Aldis Hodge, Lauren E. Banks, Amanda Clayton",7.6,9041,2019
Dynasty,42,Drama,"Elizabeth Gillies, Grant Show, Rafael de la Fuente, Robert Christopher Riley",7.3,16123,2017
Flack,60,"Comedy, Drama","Anna Paquin, Lydia Wilson, Rebecca Benson, Sophie Okonedo",7.1,3724,2019
The O.C.,44,"Comedy, Drama, Romance","Mischa Barton, Adam Brody, Peter Gallagher, Kelly Rowan",7.5,82800,2003
Big Little Lies,60,"Crime, Drama, Mystery","Reese Witherspoon, Nicole Kidman, Shailene Woodley, Zoë Kravitz",8.5,164819,2017
Chicago Med,43,Drama,"Nick Gehlfuss, Brian Tee, Marlyne Barrett, S. Epatha Merkerson",7.6,16783,2015
Glee,44,"Comedy, Drama, Music","Lea Michele, Jane Lynch, Matthew Morrison, Cory Monteith",6.7,138844,2009
The Originals,45,"Drama, Fantasy, Horror","Joseph Morgan, Daniel Gillies, Claire Holt, Phoebe Tonkin",8.2,121133,2013
Godfather of Harlem,55,"Crime, Drama","Forest Whitaker, Nigel Thatch, Ilfenesh Hadera, Lucy Fry",8,8161,2019
Gossip Girl,42,"Drama, Romance","Blake Lively, Leighton Meester, Penn Badgley, Ed Westwick",7.4,157721,2007
Broadchurch,48,"Crime, Drama, Mystery","David Tennant, Olivia Colman, Jodie Whittaker, Andrew Buchan",8.4,98982,2013
Black Summer,40,"Action, Drama, Horror","Justin Chu Cary, Jaime King, Christine Lee, Sal Velez Jr.",6.4,20101,2019
The Goldbergs,22,Comedy,"Wendi McLendon-Covey, Sean Giambrone, Troy Gentile, Hayley Orrantia",8.1,32650,2013
The Resident,60,Drama,"Matt Czuchry, Emily VanCamp, Manish Dayal, Bruce Greenwood",7.7,20219,2018
Banshee,60,"Action, Crime, Drama","Antony Starr, Ivana Milicevic, Ulrich Thomsen, Frankie Faison",8.4,90222,2013
The Chosen,54,"Drama, History","Shahar Isaac, Jonathan Roumie, Paras Patel, George Harrison Xanthis",9.7,16611,2017
Daredevil,54,"Action, Crime, Drama","Charlie Cox, ""Vincent DOnofrio"", Deborah Ann Woll, Elden Henson",8.6,371065,2015
The Punisher,53,"Action, Crime, Drama","Jon Bernthal, Amber Rose Revah, Ben Barnes, Jason R. Moore",8.5,191555,2017
Smallville,60,"Adventure, Drama, Romance","Tom Welling, Michael Rosenbaum, Allison Mack, Kristin Kreuk",7.5,118498,2001
Fringe,46,"Drama, Mystery, Sci-Fi","Anna Torv, Joshua Jackson, John Noble, Jasika Nicole",8.4,224181,2008
Special,15,"Comedy, Drama","""Ryan OConnell"", Jessica Hecht, Punam Patel, Marla Mindelle",7.6,7573,2019
House of Cards,51,Drama,"Kevin Spacey, Michel Gill, Robin Wright, Kate Mara",8.7,473737,2013
Entourage,28,"Comedy, Drama","Kevin Connolly, Adrian Grenier, Kevin Dillon, Jerry Ferrara",8.4,160042,2004
Letterkenny,30,Comedy,"Jared Keeso, Nathan Dales, Michelle Mylett, Andrew Herr",8.6,15406,2016
Cold Case,44,"Crime, Drama, Mystery","Kathryn Morris, Danny Pino, John Finn, Jeremy Ratchford",7.6,24801,2003
13 Reasons Why,60,"Drama, Mystery, Thriller","Dylan Minnette, Katherine Langford, Christian Navarro, Alisha Boe",7.6,262763,2017
FBI,60,"Action, Crime, Drama","Missy Peregrym, Zeeko Zaki, Jeremy Sisto, Ebonee Noel",6.8,11497,2018
The Americans,44,"Crime, Drama, Mystery","Keri Russell, Matthew Rhys, Keidrich Sellati, Holly Taylor",8.4,87570,2013
Gotham,42,"Action, Crime, Drama","Ben McKenzie, Jada Pinkett Smith, Donal Logue, Camren Bicondova",7.8,214918,2014
Monk,44,"Comedy, Crime, Drama","Tony Shalhoub, Jason Gray-Stanford, Ted Levine, Traylor Howard",8,67242,2002
How to Get Away with Murder,43,"Crime, Drama, Mystery","Viola Davis, Billy Brown, Jack Falahee, Aja Naomi King",8.1,134288,2014
One Tree Hill,60,"Drama, Romance, Sport","Chad Michael Murray, James Lafferty, Hilarie Burton, Bethany Joy Lenz",7.7,73211,2003
The Leftovers,60,"Drama, Fantasy, Mystery","Justin Theroux, Amy Brenneman, Christopher Eccleston, Liv Tyler",8.3,83870,2014
Çukur,120,"Action, Crime, Thriller","Aras Bulut Iynemli, Riza Kocaoglu, Cem Uslu, Ertugrul Aytaç Usun",7.4,11695,2017
Good Witch,48,"Comedy, Drama, Fantasy","Catherine Bell, Catherine Disher, James Denton, Kylee Evans",7.3,7983,2015
Van Helsing,43,"Action, Drama, Fantasy","Kelly Overton, Jonathan Scarfe, Aleks Paunovic, Rukiya Bernard",6.2,18844,2016
Doom Patrol,60,"Action, Adventure, Comedy","Diane Guerrero, April Bowlby, Matt Bomer, Brendan Fraser",7.9,36985,2019
What We Do in the Shadows,30,"Comedy, Fantasy, Horror","Kayvan Novak, Matt Berry, Natasia Demetriou, Harvey Guillén",8.5,40152,2019
Rizzoli & Isles,60,"Crime, Drama, Mystery","Angie Harmon, Sasha Alexander, Jordan Bridges, Bruce McGill",7.6,30512,2010
Mom,30,"Comedy, Drama, Romance","Allison Janney, Anna Faris, Mimi Kennedy, Beth Hall",7.2,29855,2013
Jane the Virgin,60,Comedy,"Gina Rodriguez, Andrea Navedo, Yael Grobglas, Justin Baldoni",7.8,40669,2014
Girl From Nowhere,45,"Crime, Drama, Fantasy","Chicha Amatayakul, Tris Ren, Naomi Amante, Rich Ting",7.7,2267,2018
Boardwalk Empire,55,"Crime, Drama, History","Steve Buscemi, Kelly Macdonald, Michael Shannon, Shea Whigham",8.5,175133,2010
Pretty Little Liars,44,"Drama, Mystery, Romance","Troian Bellisario, Ashley Benson, Lucy Hale, Shay Mitchell",7.4,154731,2010
Six Feet Under,55,"Comedy, Drama","Peter Krause, Michael C. Hall, Frances Conroy, Lauren Ambrose",8.7,123860,2001
L.A.'s Finest,60,"Action, Comedy, Crime","Jessica Alba, Gabrielle Union, Duane Martin, Zach Gilford",6,4864,2019
White Collar,40,"Comedy, Crime, Drama","Matt Bomer, Tim DeKay, Willie Garson, Tiffani Thiessen",8.2,121025,2009
The Man in the High Castle,60,"Drama, Sci-Fi, Thriller","Alexa Davalos, Luke Kleintank, Rufus Sewell, Rupert Evans",8,90559,2015
Designated Survivor,60,"Action, Drama, Mystery","Kiefer Sutherland, Adan Canto, Italia Ricci, Kal Penn",7.5,80308,2016
Hunter x Hunter,24,"Animation, Action, Adventure","Issei Futamata, Megumi Han, Cristina Valenzuela, Mariya Ise",9,65604,2011
Grace and Frankie,30,Comedy,"Jane Fonda, Lily Tomlin, Sam Waterston, Martin Sheen",8.3,40690,2015
Mayans M.C.,60,"Crime, Drama, Thriller","JD Pardo, Clayton Cardenas, Sarah Bolger, Michael Irby",7.6,13838,2018
Fleabag,27,"Comedy, Drama","Phoebe Waller-Bridge, Sian Clifford, Olivia Colman, Jenny Rainsford",8.7,112732,2016
American Gods,60,"Drama, Fantasy, Mystery","Ricky Whittle, Emily Browning, Yetide Badaki, Bruce Langley",7.7,79190,2017
Hannibal,44,"Crime, Drama, Horror","Hugh Dancy, Mads Mikkelsen, Caroline Dhavernas, Laurence Fishburne",8.5,234047,2013
Last Man Standing,30,Comedy,"Tim Allen, Nancy Travis, Hector Elizondo, Christoph Sanders",7.5,30497,2011
The Fall,60,"Crime, Drama, Thriller","Gillian Anderson, Jamie Dornan, John Lynch, Aisling Franciosi",8.1,87921,I 20
Person of Interest,43,"Action, Crime, Drama","Jim Caviezel, Taraji P. Henson, Kevin Chapman, Michael Emerson",8.4,165694,2011
Unforgotten,45,"Crime, Drama, Mystery","Sanjeev Bhaskar, Jordan Long, Lewis Reeves, Nicola Walker",8.3,16153,2015
Snowfall,44,"Crime, Drama","Damson Idris, Carter Hudson, Isaiah John, Sergio Peris-Mencheta",8.2,12709,2017
Barry,30,"Action, Comedy, Crime","Bill Hader, Stephen Root, Sarah Goldberg, Anthony Carrigan",8.3,49813,2018
Warrior,60,"Action, Crime, Drama","Andrew Koji, Olivia Cheng, Jason Tobin, Dianne Doan",8.4,20298,2019
His Dark Materials,60,"Adventure, Drama, Family","Dafne Keen, Amir Wilson, Kit Connor, Ruth Wilson",7.9,55200,2019
Archer,22,"Animation, Action, Comedy","H. Jon Benjamin, Judy Greer, Amber Nash, Chris Parnell",8.6,140355,2009
Naruto: Shippûden,24,"Animation, Action, Adventure","Junko Takeuchi, Maile Flanagan, Kate Higgins, Chie Nakamura",8.6,91846,2007
