Title,EpisodeDuration(in Minutes),Genres,Actors,Rating,Votes,Updated Years
Danger 5,nan,"Action, Adventure, Comedy","David Ashby, Sean James Murphy, Natasa Ristic, Amanda Simons",8.4,4307,2011
No Small Parts,nan,"Documentary, Biography","Brandon Hardesty, Ashwini Kulkarni, Shweta Tripathi, Wesley Mann",7.9,879,2014
Holey Moley,nan,"Game-Show, Reality-TV","Joe Tessitore, Rob Riggle, Stephen Curry, Edgar Gonzalez",6.9,783,2019
Dark/Web,nan,"Horror, Mystery, Thriller","Brian Elerding, Lana McKissack, Michael Nardelli, Sibongile Mlambo",5.5,656,2019
Living the Dream,nan,"Comedy, Drama","Philip Glenister, Lesley Sharp, Rosie Day, ""Brenock OConnor""",6.7,518,I 20
Irene Huss,nan,"Crime, Drama, Thriller","Angela Kovacs, Reuben Sallmander, Lars Brandeby, Dag Malmberg",6.6,328,2007
Bella and the Bulldogs,nan,"Comedy, Family, Sport","Brec Bassinger, Coy Stewart, Jackie Radinsky, Buddy Handleson",5.4,1484,2015
Dystopia,nan,Sci-Fi,"Michael Copon, Simon Phillips, She, Eve Mauro",4.9,412,2019
MasterChef,nan,Reality-TV,"Jordi Cruz, Pepe Rodríguez, Samantha Vallejo-Nágera, Eva González",6.8,186,2013
Real Husbands of Hollywood,nan,Comedy,"Kevin Hart, Duane Martin, Nick Cannon, Cynthia Kaye McWilliams",7.6,4020,2013
Video Game High School,nan,"Action, Romance, Sci-Fi","Josh Blaylock, Ellary Porterfield, Johanna Braddy, Jimmy Wong",7.6,12816,2012
Deal or No Deal,nan,"Comedy, Family, Game-Show","Howie Mandel, Patricia Kara, Megan Abrigo, Sara Bronson",5,3683,2005
Rozario to banpaia,nan,"Animation, Comedy, Fantasy","Daisuke Kishio, Nana Mizuki, Tia Lynn Ballard, Leah Clark",7,2655,2008
Less Than Perfect,nan,Comedy,"Sara Rue, Zachary Levi, Andrea Parker, Andy Dick",7,3183,2002
The Bill Engvall Show,nan,"Comedy, Family","Bill Engvall, Nancy Travis, Jennifer Lawrence, Graham Patrick Martin",5.6,1914,2007
Garage Sale Mysteries,nan,"Crime, Mystery","Lori Loughlin, Sarah Strange, Steve Bacic, ""Kevin OGrady""",7.2,148,2013
Getting On,nan,Comedy,"Laurie Metcalf, Alex Borstein, Niecy Nash, Mel Rodriguez",7.8,3218,2013
"Tim and Eric Awesome Show, Great Job!",nan,"Comedy, Music","Tim Heidecker, Eric Wareheim, Bob Odenkirk, John C. Reilly",7.5,10813,2007
Elimi birakma,nan,Drama,"Alina Boz, Alp Navruz, Dolunay Soysert, Ebru Aykaç",6.5,1098,2018
How to Stay Married,nan,Comedy,"Peter Helliar, Lisa McCune, Willow Ryan-Fuller, Vivien Turner",4.9,157,2018
Sex Chronicles,nan,"Drama, Romance","Patrice Fisher, Johanna Quintero, Laila Odom, Maya Dunbar",5.9,409,2008
Lab Rats: Elite Force,30,"Adventure, Comedy, Drama","William Brent, Bradley Steven Perry, Jake Short, Paris Berelc",6.5,1112,2016
Coisa Mais Linda,45,"Drama, Romance","Maria Casadevall, Pathy Dejesus, Mel Lisboa, Leandro Lima",7.9,3001,2019
I Am a Killer,52,"Documentary, Crime","Swaylee Loughnane, Reece Putinas, David Galea, Deandra Buchanan",7.4,3429,2018
Love O2O,45,"Drama, Romance","Yang Yang, Shuang Zheng, Denny Huang, Junfeng Niu",8,1852,2016
Be Careful with My Heart,120,"Comedy, Romance","Jodi Sta. Maria, Richard Yap, Aiza Seguerra, Mutya Orquia",8.1,229,2012
Istanbullu Gelin,30,"Comedy, Drama, Romance","Özcan Deniz, Asli Enver, Ipek Bilgin, Salih Bademci",6.6,1803,2017
Bondi Rescue,30,"Documentary, Drama, Reality-TV","Osher Günsberg, Dean Gladstone, Bruce Hopkins, ""Trent Maxi Maxwell""",7.6,928,2006
Ugly Americans,58,"Animation, Comedy, Fantasy","Matt Oberg, Natasha Leggero, Kurt Metzger, Randy Pearlstein",8,9536,2010
Merlí,28,"Comedy, Drama, Romance","Francesc Orella, Pere Ponce, Carlos Cuevas, Marta Marco",8.6,7434,2015
M.I.High,24,"Action, Comedy, Crime","Chris Stanton, Jonny Freeman, Rachel Petladwala, Channelle Owen",6.2,1033,2007
Shinya shokudô,41,Drama,"Kaoru Kobayashi, Mansaku Fuwa, Toshiki Ayata, Shôhei Uno",8.6,1606,2009
Frontera Verde,30,"Crime, Drama, Thriller","Nelson Camayo, Angela Cano, Juana del Rio, Miguel Dionisio Ramos",7.3,2206,2019
Lip Sync Battle,20,Music,"C.J. Tyson, LL Cool J, Chrissy Teigen, Amanda Cleghorn",7.3,3466,2015
Quantum Break,15,"Action, Crime, Drama","Shawn Ashmore, Aidan Gillen, Patrick Heusinger, Marshall Allman",7.9,1603,2016
Jake and the Never Land Pirates,47,"Animation, Adventure, Family","David Arquette, Corey Burton, Jeff Bennett, Loren Hoskins",5.6,1418,2011
I Am...,21,Drama,"Gemma Chan, Vicky McClure, Samantha Morton, Ed Coleman",7,256,2019
Power Rangers Dino Charge,30,"Action, Adventure, Family","Brennan Mejia, Camille Hyde, Yoshi Sudarso, Michael Taber",6.5,1160,2015
Bakuten shoot beyblade,22,"Animation, Action, Family","Marlowe Gardiner-Heslin, Alex Hood, Gage Knox, Daniel DeSanto",6.9,5485,2001
Gantz,60,"Animation, Action, Comedy","Chris Ayres, Emily Carter-Essex, Shannon Emerick, John Gremillion",7.2,7178,2004
Tremors,24,"Action, Adventure, Comedy","Victor Browne, Gladise Jiminez, Marcia Strassman, Lela Lee",6.6,2627,2003
Invader ZIM,30,"Animation, Action, Adventure","Andy Berman, Richard Steven Horvitz, Rikki Simons, Melissa Fahn",8.3,19741,2001
Crank Yankers,60,"Animation, Comedy","Victor Yerrid, Artie Esposito, Paul McGinnis, BJ Guyer",6.2,2857,2002
Those Who Kill,60,"Action, Crime, Drama","Chloë Sevigny, ""James DArcy"", James Morrison, Bruce Davison",7.2,3568,2014
Dead of Summer,60,"Drama, Fantasy, Horror","Elizabeth Mitchell, Elizabeth Lail, Alberto Frezza, Mark Indelicato",6.2,4380,2016
Reef Break,22,"Crime, Drama","Poppy Montgomery, Ray Stevenson, Desmond Chiam, Melissa Bonne",6,1774,2019
Lilo & Stitch: The Series,21,"Animation, Action, Adventure","Daveigh Chase, Chris Sanders, David Ogden Stiers, Kevin McDonald",6.8,8805,2003
One Big Happy,45,Comedy,"Elisha Cuthbert, Nick Zano, Kelly Brook, Rebecca Corry",5.7,2808,2015
Party of Five,30,"Drama, Family, Romance","Brandon Larracuente, Niko Guardado, Emily Tosta, Elle Paris Legaspi",5.4,1075,2020
Evermoor,30,"Adventure, Family, Fantasy","Alex Starke, Margaret Cabourn-Smith, Clive Rowe, Finney Cassidy",6.2,557,2014
People Magazine Investigates,44,"Documentary, Crime","Steve Helling, David Christopher Wells, Michael Wayne Brown, Alicia Dennis",7.6,427,2016
Car Share,30,Comedy,"Peter Kay, Sian Gibson, Danny Swarsbrick, Guy Garvey",8.3,4254,2015
Battle Creek,45,"Comedy, Crime, Drama","Josh Duhamel, Dean Winters, Aubrey Dollar, Edward Fordham Jr.",7.3,8268,2015
The Letdown,24,Comedy,"Alison Bell, Duncan Fellows, Leon Ford, Sacha Horler",7.5,2837,2017
"Three Lives Three Worlds, Ten Miles of Peach Blossom",120,"Drama, Fantasy, Romance","Mi Yang, Mark Chao, Weiguang Gao, Ken Chang",8.3,1867,2017
Kekkai Sensen,24,"Animation, Action, Adventure","Daisuke Sakaguchi, Kazuya Nakai, Aaron Dismuke, Phil Parsons",7.3,1735,2015
Muhtesem Ikili,60,"Action, Crime","Ibrahim Celikkol, Kerem Bürsin, Özge Gürel, Öykü Karayel",6.3,715,2018
Nature Cat,60,"Animation, Action, Adventure","Taran Killam, Kate McKinnon, Kate Micucci, Bobby Moynihan",7.2,287,2015
Small Fortune,90,Game-Show,"""Dermot OLeary"", Brian Blessed, James Haskell, Chloe Madeley",3.1,29,2019
Washington Heights,440,Reality-TV,,6.6,73,2013
Fatmagül'ün Suçu Ne?,45,"Drama, Romance","Beren Saat, Engin Akyürek, Firat Çelik, Murat Daltaban",5.7,6010,2010
Midnight Sun,60,"Crime, Drama, Mystery","Leïla Bekhti, Gustaf Hammarsten, Albin Grenholm, Jakob Hultcrantz Hansson",7.5,4679,2016
Some Assembly Required,30,"Comedy, Family","Kolton Stewart, Harrison Houde, Sydney Scotia, Charlie Storwick",3.7,755,2014
Case,11,"Crime, Drama, Mystery","Steinunn Ólína Þorsteinsdóttir, Magnús Jónsson, Birna Rún Eiríksdóttir, Elma Stefania Agustsdottir",7.1,2323,2015
A Touch of Cloth,60,"Action, Comedy, Crime","John Hannah, Suranne Jones, Navin Chowdhry, Adrian Bower",7.9,3570,2012
Teachers,40,Comedy,"Caitlin Barlow, Katy Colloton, Kate Lambert, ""Katie OBrien""",6.5,3140,2016
The Greatest Event in Television History,60,Comedy,"Amanda Anka, Jeff Probst, Jon Schroeder, Adam Scott",7.9,677,2012
Expedition Bigfoot,24,Adventure,"Mireya Mayor, Russell Acord, Ronny Leblanc, Bryce Johnson",5.2,319,2019
Ghost Wars,50,"Drama, Fantasy, Horror","Avan Jogia, Kim Coates, Luvia Petersen, Jesse Moss",6.3,4356,2017
The Bisexual,44,"Comedy, Drama","Desiree Akhavan, Maxine Peake, Brian Gleeson, Saskia Chana",6.3,990,2018
My Mother and Other Strangers,60,"Drama, Romance, War","Ciarán Hinds, Michael Nevin, Hattie Morahan, Owen McDonnell",7.4,1390,2016
Orange,30,"Animation, Drama, Romance","Jill Harris, Jason Liebrecht, Micah Solusod, Jeannie Tirado",7.6,2541,2016
Weissensee,44,"Drama, History","Florian Lukas, Jörg Hartmann, Uwe Kockisch, Ruth Reinecke",8.2,1866,2010
Vegas,7,"Action, Crime, Drama","Dennis Quaid, Michael Chiklis, Carrie-Anne Moss, Taylor Handley",7.3,7165,2012
Les rivières pourpres,60,"Crime, Mystery, Thriller","Olivier Marchal, Erika Sainte, Claude Perron, Ken Duken",6.8,1197,2018
Ghosted,22,"Comedy, Crime, Horror","Adam Scott, Craig Robinson, Ally Walker, Adeel Akhtar",6.3,5785,I 20
Bigger,60,Comedy,"Tanisha Long, Chase Anthony, Angela Ko, Angell Conwell",8.2,164,2019
Ekaterina,22,"Biography, Drama, History","Marina Aleksandrova, Sergey Koltakov, Michael Gor, Isabel Schosnig",8.1,1276,2014
Shaun the Sheep,24,"Animation, Short, Comedy","Justin Fletcher, John Sparkes, Richard Webber, Kate Harbour",8.2,12571,2007
Dr. Phil,60,"Drama, Reality-TV, Talk-Show","Phil McGraw, Robin McGraw, T.D. Jakes, Travis Stork",4,3330,2002
Trial & Error,53,"Comedy, Crime, Mystery","""Nicholas DAgosto"", Jayma Mays, Steven Boyer, Sherri Shepherd",8,5502,2017
Reverie,60,"Drama, Sci-Fi, Thriller","Sarah Shahi, Dennis Haysbert, Sendhil Ramamurthy, Jessica Lu",6.6,3572,2018
Freakish,43,"Horror, Sci-Fi","Leo Howard, Liza Koshy, Adam Hicks, Meghan Rienks",6.3,2570,2016
Liza on Demand,56,Comedy,"Liza Koshy, Travis Coles, Kimiko Glenn, Casey Simpson",5,923,2018
Tales,11,Drama,"David Dunston, Alzie Williams, J. Alphonse Nicholson, Irv Gotti",5.9,399,2017
Mercy Street,43,"Drama, History","McKinley Belcher III, Suzanne Bertish, Norbert Leo Butz, Gary Cole",7.5,2413,2016
Total Control,60,Drama,"Deborah Mailman, Rachel Griffiths, Harry Richardson, Rob Collins",7.7,595,2019
Property Brothers,40,Reality-TV,"Drew Scott, Jonathan Silver Scott, Andria Barrett, Katie Hunt",7.1,2864,2011
In the Flesh,22,"Drama, Horror","Luke Newberry, Harriet Cains, Marie Critchley, Steve Cooper",8,12817,2013
Steven Universe Future,30,"Animation, Action, Adventure","Michaela Dietz, Estelle, Deedee Magno, Zach Callison",7.5,556,2019
Mountain Monsters,30,Reality-TV,"Jacob Lowe, Trapper John Tice, Huckleberry Joe Lott, Willy McQuillian",5.1,1344,2013
The Gates,44,"Crime, Drama, Fantasy","Rhona Mitra, Frank Grillo, Marisol Nichols, Luke Mably",7.1,7884,2010
Siempre Bruja,30,"Drama, Fantasy","Sofía Araujo Mejía, Angely Gaviria, Sofía Araújo, Dylan Fuentes",6.2,2139,2019
Wonder Pets!,24,"Animation, Adventure, Family","Sofie Zamchick, Teala Dunn, Danica Lee, Dawn Evans",6.4,1484,2005
Comedy Bang! Bang!,50,"Comedy, Talk-Show","Scott Aukerman, Reggie Watts, ""Weird Al Yankovic"", Neil Campbell",7.6,3942,2012
The Kids Are Alright,23,Comedy,"Mary McCormack, Jack Gore, Sam Straley, Caleb Foote",7.9,3048,2018
Face Off,42,"Game-Show, Reality-TV","McKenzie Westmore, Glenn Hetrick, Ve Neill, Michael Westmore",8.2,6149,2011
Trinity Seven: 7-nin no Masho Tsukai,45,"Animation, Action, Comedy","Cameron Bautsch, Brittney Karbowski, Yoshitsugu Matsuoka, Carli Mosier",6.8,1712,2014
Max & Ruby,60,"Animation, Family","Lynn Cleckner, Lorraine Parsloe, Loretta Jafelice, Juliet Rusche",6.1,1976,2002
Grand Blue,25,"Animation, Adventure, Comedy","Yuma Uchida, Ryohei Kimura, Hiroki Yasumoto, Katsuyuki Konishi",7.9,1693,2018
The Green Green Grass,30,Comedy,"John Challis, Sue Holderness, David Ross, Jack Doolan",6.7,962,2005
Moone Boy,22,Comedy,"""Chris ODowd"", David Rawle, ""Deirdre OKane"", Peter McDonald",8.1,5567,2012
Zindagi Gulzar Hai,30,Romance,"Sanam Saeed, Fawad Khan, Samina Peerzada, Sheheryar Munawar",8.9,3210,2012
Hierro,21,"Crime, Mystery, Thriller","Candela Peña, Darío Grandinetti, Kimberley Tell, Luifer Rodríguez",7.6,1605,2019
Privileged,4,Comedy,"JoAnna Garcia Swisher, Lucy Hale, Ashley Newbrough, Allan Louis",6.8,3789,2008
Real Time with Bill Maher,40,"Comedy, News, Talk-Show","Bill Maher, Andrew Sullivan, Michael Moore, Arianna Huffington",7.3,12616,2003
Nisekoi,30,"Animation, Comedy, Romance","Koki Uchiyama, Nao Tôyama, Kana Hanazawa, Yumi Uchiyama",7.2,2726,2014
Dongbaekkkot Pil Muryeop,27,"Comedy, Drama, Romance","Kong Hyo-Jin, Ji-seok Kim, Kang Ha-Neul, Oh Jeong-Se",8,1687,2019
About a Boy,60,"Comedy, Drama, Romance","David Walton, Benjamin Stockham, Al Madrigal, Minnie Driver",7.4,8175,2014
Forhøret,45,"Crime, Drama, Mystery","Ulrich Thomsen, Alma Ekehed Thomsen, Katrine Greis-Rosenthal, Nikolaj Lie Kaas",7,1259,2019
Dr. Ken,22,Comedy,"Ken Jeong, Suzy Nakamura, Tisha Campbell, Jonathan Slavin",5.7,3884,2015
Mickey Mouse,22,"Animation, Comedy, Family","Chris Diamantopoulos, Russi Taylor, Bill Farmer, Tony Anselmo",8.1,2412,2013
Go! Vive a Tu Manera,29,"Comedy, Musical, Romance","Rebecca Davis, Marley Estrada, Marina Gridley, Alyssa LeBarron",7,461,2019
Who Is America?,23,Comedy,"Sacha Baron Cohen, Roy Elghanayan, Emanuela Postacchini, Alfred Pierce",8.3,17622,2018
Home,30,"Comedy, Drama","Rufus Jones, Rebekah Staton, Youssef Kerkour, Oaklee Pendergast",7.9,767,2019
Overhaulin',60,"Documentary, Reality-TV, Sport","Chip Foose, Lee Reherman, Craig Chaffers, Chris Jacobs",6.8,1418,2004
Dancing Queen,43,"Music, Reality-TV","Alyssa Edwards, Atlee Millard, Marcella Raneri, ""D.J. Shangela Pierce""",7,1392,2018
The Class,46,"Comedy, Romance","Andrea Anders, Jon Bernthal, Lizzy Caplan, Jesse Tyler Ferguson",7.7,4542,2006
I Didn't Do It,21,"Comedy, Drama, Family","Olivia Holt, Austin North, Piper Curda, Peyton Clark",6,2285,2014
The Test Case,23,"Action, Drama","Nimrat Kaur, Akshay Oberoi, Atul Kulkarni, Manit Joura",8.4,1425,2018
A Young Doctor's Notebook & Other Stories,384,"Comedy, Drama","Jon Hamm, Daniel Radcliffe, Rosie Cavaliero, Adam Godley",7.9,14937,2012
My Boys,60,"Comedy, Romance","Jordana Spiro, Kyle Howard, Reid Scott, Michael Bunin",7.3,4774,2006
Fixer Upper,26,Reality-TV,"Chip Gaines, Joanna Gaines, Dustin Anderson, Clint Harp",8.2,2782,2013
Det som göms i snö,26,"Crime, Drama, Mystery","Robert Gustafsson, Ia Langhammer, Maria Sundbom Lörelius, Johan Ulveson",7.4,1695,2018
Stella Blómkvist,75,"Crime, Drama, Thriller","Heida Reed, Sara Dögg Ásgeirsdóttir, Kristín Þóra Haraldsdóttir, Þorsteinn Guðmundsson",6.8,756,2017
Mickey and the Roadster Racers,60,"Animation, Short, Adventure","Bill Farmer, Nika Futterman, Bret Iwan, Tress MacNeille",6.1,455,2017
Confess,30,"Drama, Romance","Katie Leclerc, Ryan Cooper, Nea Dune, Sherilyn Fenn",7.9,1901,2017
Baccano!,22,"Animation, Action, Adventure","Michael C. Pizzuto, J. Michael Tatum, Caitlin Glass, Akemi Kanda",8.3,10760,2007
Geunyeoneun yeppeodda,35,"Comedy, Romance","Hwang Jeong-eum, Seo Jun Park, Jun-hee Ko, Si Won Choi",7.7,3884,2015
Los Espookys,30,"Comedy, Fantasy, Horror","Cassandra Ciangherotti, Ana Fabrega, Julio Torres, Bernardo Velasco",7.6,1494,2018
Project Mc²,30,Family,"Mika Abdalla, Ysa Penarejo, Victoria Vida, Genneya Walton",6,803,2015
El barco,90,"Adventure, Drama, Mystery","Juanjo Artero, Mario Casas, Blanca Suárez, Irene Montalà",7.3,4410,2011
The A Word,40,Drama,"Max Vento, Lee Ingleby, Christopher Eccleston, Molly Wright",7.8,1907,2016
The Girl's Guide to Depravity,46,Comedy,"Rebecca Blumhagen, Joe Komara, Jesse Liebman, Sally Golan",6.6,737,2012
Power Rangers Samurai,45,"Action, Adventure, Comedy","Alexander P. Heartman, Erika Fong, Hector David Jr., Najee De-Tiege",5,1949,2011
The Angry Video Game Nerd,46,"Comedy, Fantasy, Sci-Fi","James Rolfe, Mike Matei, Kyle Justin, Antonio Piluso",8.5,14103,2004
Sonic X,60,"Animation, Action, Adventure","Gabriella Lewis, ""Junichi Kanemaru"", Sanae Kobayashi, Jason Griffith",6.2,3898,2003
Trophy Wife,30,Comedy,"Malin Akerman, Bradley Whitford, Michaela Watkins, Natalie Morales",6.9,6306,2013
Yer Gök Ask,30,Romance,"Birce Akalay, Murat Ünalmis, Kanbolat Gorkem Arslan, Levend Yilmaz",4,429,2010
American Gothic,25,"Crime, Drama, Mystery","Juliet Rylance, Antony Starr, Justin Chatwin, Megan Ketch",6.7,4274,2016
Homestead Rescue,60,Reality-TV,"Marty Raney, Matt Raney, Misty Raney, Rick Robles",7.7,329,2016
The Bletchley Circle: San Francisco,44,"Crime, Drama, Mystery","Crystal Balint, Rachael Stirling, Chanelle Peloso, Julie Graham",6.9,2009,2018
A Nero Wolfe Mystery,30,"Action, Drama, Mystery","Timothy Hutton, Maury Chaykin, Colin Fox, Bill Smitrovich",8.4,1572,2001
Dakteo Yibangin,24,"Action, Drama, Romance","Lee Jong-Suk, Se-Yeon Jin, Ho-jin Chun, Park Hae-Joon",7.4,2101,2014
Snapped,47,"Documentary, Crime","Sharon Martin, Jody Flader, Daniel Lukes, David Thomasson",7.8,1079,2004
Coop and Cami Ask the World,74,"Adventure, Comedy, Family","Dakota Lotus, Ruby Rose Turner, Olivia Sanabia, Albert Tsai",5.9,396,2018
Sessão de Terapia,22,Drama,"Zécarlos Machado, Selton Mello, Mayara Constantino, Selma Egrei",8.4,251,2012
Charlie's Angels,60,"Action, Adventure, Crime","Annie Ilonzeh, Minka Kelly, Rachael Taylor, Ramon Rodriguez",4.4,4061,2011
Bonusfamiljen,60,"Comedy, Drama","Vera Vitali, Erik Johansson, Fredrik Hallgren, Frank Dorsin",7.6,2793,2017
TRON: Uprising,21,"Animation, Action, Adventure","Elijah Wood, Tricia Helfer, Charlie Bean, Elizabeth Ho",8.2,7820,2012
Vanpaia naito,42,"Animation, Action, Drama","Yui Horie, Mamoru Miyano, Daisuke Kishio, Jun Fukuyama",7.4,4666,2008
Aetaneun Romaenseu,45,"Comedy, Romance","Ji-eun Song, Sung Hoon, Jae-young Kim, Da-Sol Jeong",7.1,2239,2017
Ultimate Force,44,"Action, War","Ross Kemp, Miles Anderson, Christopher Fox, Danny Sapani",7.6,1949,2002
Alone Together,6,Comedy,"Esther Povitsky, Benji Aflalo, Edgar Blackmon, ""Chris DElia""",6.6,1709,I 20
El marginal,44,"Crime, Drama, Mystery","Martina Gusman, Gerardo Romano, Claudio Rissi, Nicolás Furtado",8.2,2960,2016
So You Think You Can Dance,30,"Game-Show, Music, Reality-TV","Cat Deeley, Nigel Lythgoe, Mark Thompson, Mary Murphy",6.8,9992,2005
Sex & Drugs & Rock & Roll,60,"Comedy, Music","Denis Leary, John Corbett, Elizabeth Gillies, Elaine Hendrix",7.1,3263,2015
Ambitions,30,Drama,"Brian White, Robin Givens, Kendrick Cross, Brely Evans",5.3,555,2019
WPC 56,60,"Crime, Drama, Romance","""Charles DeAth"", John Bowler, Jennie Jacques, Mark Healy",7.3,699,2013
Life Sentence,30,"Comedy, Drama","Lucy Hale, Elliot Knight, Jayson Blair, Brooke Lyons",6.6,3528,2018
Red vs. Blue,45,"Animation, Short, Action","Gus Sorola, Burnie Burns, Geoff Ramsey, Jason Saldaña",8.3,8949,2003
The Chicago Code,30,"Action, Crime, Drama","Jason Clarke, Jennifer Beals, Matt Lauria, Devin Kelley",7.7,7933,2011
Raised by Wolves,12,Comedy,"Philip Jackson, Rebekah Staton, Helen Monks, Alexa Davies",8.2,1537,2013
Melrose Place,22,"Drama, Romance","Katie Cassidy, Stephany Jacobsen, Jessica Lucas, Michael Rady",6,3908,2009
Zapped,60,"Comedy, Fantasy","James Buckley, Kenneth Collard, Louis Emerick, Paul Kaye",6.8,1191,2016
Mysteries of the Abandoned,60,Documentary,"Dominic Selwood, Kasper Michaels, Andrew Gough, Rob Bell",7.3,419,2017
Mr. D,22,Comedy,"Gerry Dee, Jonathan Torrens, Lauren Hammersley, Bette MacDonald",6.6,1972,2012
La Doña,60,"Drama, Romance","Aracely Arámbula, José María Galeano, Andrea Martí, Leo Deluglio",6.8,540,2016
Wander Over Yonder,13,"Animation, Adventure, Comedy","Jack McBrayer, April Winchell, Keith Ferguson, Tom Kenny",7.2,3446,2013
Dante's Cove,30,"Drama, Horror, Mystery","William Gregory Lee, Gregory Michael, Tracy Scoggins, Charlie David",5.9,2049,2004
Zac and Mia,60,Drama,"Anne Winters, Kian Lawley, Keli Daniels, Tory Devon Smith",7.9,529,2017
6Teen,60,"Animation, Comedy, Drama","Jess Mal Gibbons, Megan Fahlenbock, Stacey DePass, ""Brooke DOrsay""",7.2,5264,2004
Scrubs: Interns,608,Comedy,"Jae Hitch, Sonal Shah, Betsy Beutler, Todd Bosley",5.6,1702,2009
The Whispers,24,"Drama, Horror, Mystery","Lily Rabe, Barry Sloane, Milo Ventimiglia, Derek Webster",7.2,10410,2015
Witchblade,25,"Action, Drama, Fantasy","Yancy Butler, David Chokachi, Anthony Cistaro, Will Yun Lee",6.5,2382,2001
T.O.T.S.,30,"Animation, Adventure, Comedy","Jet Jurgensmeyer, Christian J. Simon, Megan Hilty, Vanessa Williams",7,259,2019
Enemigo Íntimo,22,Drama,"Fernanda Castillo, Raúl Méndez, María del Carmen Félix, Monica Jimenez",7.4,252,2018
The Great Food Truck Race,60,"Game-Show, Reality-TV","Tyler Florence, Aunna Johnson, Darrell Johnson, Terrell Gaskin",6.6,589,2010
Gaslight,11,"Drama, Mystery","Chloë Grace Moretz, Kelsey Asbille, Taran Killam, John Gallagher Jr.",6.2,37,2019
Chacha Vidhayak Hain Humare,23,Comedy,"Zakir Khan, Vyom Sharma, Kumar Varun, Zakir Hussain",7.7,4697,2018
Survivor's Remorse,30,Drama,"RonReaco Lee, Jessie T. Usher, Erica Ash, Teyonah Parris",7,2187,2014
Law & Order: Los Angeles,75,"Crime, Drama, Mystery","Corey Stoll, Rachel Ticotin, Alfred Molina, Terrence Howard",6.7,2285,2010
Sleeper Cell,60,"Crime, Drama, Thriller","Michael Ealy, Oded Fehr, Henri Lubatti, Melissa Sagemiller",8,6026,2005
Kingdom Hospital,11,"Drama, Fantasy, Horror","Jamie Harrold, Diane Ladd, Bruce Davison, Jack Coleman",6.8,7206,2004
Drifters,55,"Animation, Action, Adventure","Justin Briner, Josh Grelle, Gwendolyn Lau, Robert McCollum",7.7,2554,2016
Young Dracula,45,"Comedy, Family, Fantasy","Keith-Lee Castle, Clare Thomas, Simon Ludders, Gerran Howell",7.6,1548,2006
Good Bones,21,Reality-TV,"Austin Aynes, Tad Starsiak, Karen Laine, Mina Starsiak",7.2,622,2016
Knight Squad,30,"Adventure, Comedy, Family","Lexi DiBenedetto, Amarr M. Wooten, Owen Joyner, Savannah Lee May",5.6,444,2018
Power Rangers S.P.D.,60,"Action, Adventure, Sci-Fi","Brandon Jay McLaren, Chris Violette, Matt Sadowski, Monica May",6.6,2730,2005
Eastwick,42,"Drama, Fantasy","Jaime Ray Newman, Lindsay Price, Rebecca Romijn, Sara Rue",6.4,8638,2009
Check It Out! with Dr. Steve Brule,24,"Comedy, Talk-Show","John C. Reilly, Carol Kraft, Doug Foster, Scott Stewart",8.5,5777,2010
Escape the Night,24,"Adventure, Fantasy, Game-Show","Joey Graceffa, Timothy DeLaGhetto, Rosanna Pansino, Justine Ezarik",5.5,863,2016
Blue Water High,22,"Drama, Family","Sophie Luck, Kate Bell, Martin Lynes, Liz Burch",7,1314,2005
Baekilui Nanggoonnim,22,"Comedy, History, Romance","Kyung-soo Do, Nam Ji-Hyun, Jo Sung-ha, Jo Han-chul",7.6,1239,2018
Love Bites,24,Comedy,"Becki Newton, Greg Grunberg, Constance Zimmer, James MacDonald",7.5,2322,2011
Apple & Onion,30,"Animation, Short, Comedy","Sayed Badreya, George Gendi, Richard Ayoade, Kevin Michael Richardson",6,1070,2016
Born and Bred,25,Drama,"Jenna Russell, Maggie Steed, Clive Swift, Naomi Radcliffe",7.8,282,2002
Intruders,42,"Fantasy, Mystery, Thriller","James Frain, Millie Bobby Brown, Tory Kittles, Mira Sorvino",6.7,3474,2014
Powerless,90,"Comedy, Fantasy, Sci-Fi","Vanessa Hudgens, Danny Pudi, Christina Kirk, Ron Funches",6.4,6605,2017
Mighty Med,30,"Comedy, Family, Sci-Fi","Bradley Steven Perry, Jake Short, Paris Berelc, Devan Leos",6.5,1655,2013
Cheese in the Trap,60,"Comedy, Romance","Park Hae-Jin, Kim Go-eun, Seo Kang-Joon, Nam Joo-Hyuk",7.4,3252,2016
Black Box,72,Drama,"Kelly Reilly, Ditch Davey, David Ajala, Ali Wong",6.7,3619,2014
GameFace,30,Comedy,"Roisin Conaty, Damien Molony, Caroline Ginty, Dylan Edwards",7.8,1611,2017
The Hollow,120,"Animation, Drama, Family","Ashleigh Ball, Connor Parnall, Adrian Petriw, Mark Hildreth",7.2,3607,2018
The Office,60,Comedy,"Gopal Datt, Sayandeep Sengupta, Samridhi Dewan, Abhinav Sharma",6.4,3479,2019
Odd Mom Out,22,Comedy,"Jill Kargman, Andy Buckley, K.K. Glick, Sean Kleier",7,1481,2015
Golden Kamuy,23,"Animation, Action, Adventure","Haruka Shiraishi, Chikahiro Kobayashi, Kentarô Itô, Fumihiko Tachiki",8,1131,2018
Say Yes to the Dress,30,Reality-TV,"Roger Craig Smith, Randy Fenoli, Ronnie Rothstein, Mara Urshel",5.6,1726,2007
Mushishi,60,"Animation, Drama, Fantasy","Yûto Nakano, Travis Willingham, Kôjun Itô, Jennifer Seman",8.5,12119,2005
Uncanny X-Men,20,Action,"Barry Piacente, William Graves, ""John Emil DAngelo"", Tory Steele",6.9,69,2012
The Final Call,40,"Drama, Thriller","Arjun Rampal, Javed Jaffrey, Neeraj Kabi, Sakshi Tanwar",7.2,1663,2019
Banged Up Abroad,30,"Documentary, Drama","Manuel Villasenor, Jerry Murillo, Tato Alexander, Carrell Lasso",8.2,1830,2007
El Club,47,"Comedy, Drama","Alejandro Speitzer, Minnie West, Jorge Caballero, Ana Gonzalez Bello",6.3,728,2019
Street Outlaws,30,Reality-TV,"Justin Shearer, Kye Kelley, Travis Santa Cruz, Bobby Decote",6.6,974,2013
Orphan Black: The Next Chapter,60,"Drama, Sci-Fi","Evelyne Brochu, Jordan Gavaris, Tatiana Maslany",8.9,118,2019
Sarabhai V/S Sarabhai,30,Comedy,"Satish Shah, Ratna Pathak Shah, Sumeet Raghvan, Rupali Ganguly",8.8,15611,2004
Paramparça,40,"Crime, Drama","Erkan Petekkaya, Ebru Özkan, Nursel Köse, Alina Boz",5.8,1292,2014
Rescue Special Ops,48,Drama,"Daniel Amalm, Gigi Edgley, Katherine Hicks, Les Hill",7.4,782,2009
The Cool Kids,23,Comedy,"David Alan Grier, Martin Mull, Leslie Jordan, Vicki Lawrence",7,2701,2018
Vicious,60,Comedy,"Derek Jacobi, Ian McKellen, Frances de la Tour, Iwan Rheon",8.1,8147,2013
Ground Floor,42,Comedy,"Skylar Astin, Briga Heelan, Rory Scovel, Rene Gube",7.3,5095,2013
Kingdom,60,"Comedy, Drama","Stephen Fry, Karl Davies, Celia Imrie, Tony Slattery",7.9,2241,2007
Bekaaboo,43,Thriller,"Priya Banerjee, Rajeev Siddhartha, Madhussneha Upadhyay, Jitendra Hirawat",6.8,1297,2019
Kfulim,42,"Drama, Thriller","Angel Bonanni, Moris Cohen, Miki Leon, Sergey Bukhman",7.8,1235,2015
Instant Star,43,"Drama, Music","Tim Rozon, Alexz Johnson, Kristopher Turner, Laura Vandervoort",7.4,2303,2004
Swingtown,17,Drama,"Molly Parker, Jack Davenport, Grant Show, Lana Parrilla",7.6,2628,2008
