Title,EpisodeDuration(in Minutes),Genres,Actors,Rating,Votes,Updated Years
Jugar con Fuego,276,Drama,"Jason Day, Margarita Rosa de Francisco, Carlos Ponce, Laura Perico",5.9,730,2019
The Guest Book,43,Comedy,"Carly Jibson, Eddie Steeples, Charles Robinson, Lou Wilson",7.2,2596,2017
Leah Remini: Scientology and the Aftermath,2,Documentary,"Leah Remini, Mike Rinder, Mary Kahn, Claire Headley",9,5224,2016
Ben 10,60,"Animation, Short, Action","Tara Strong, Montse Hernandez, David Kaye, Roger Craig Smith",2.7,3276,2016
Sefirin Kizi,60,Drama,"Engin Akyürek, Erdal Küçükkömürcü, Konca Cilasun, Dogukan Polat",6,1738,2019
The First 48,30,"Crime, Mystery, Reality-TV","Dion Graham, Dave Walker, Nathan Schilling, Jason White",8.2,3016,2004
Kkotboda namja,23,"Comedy, Drama, Romance","Ku Hye-Sun, Lee Min-Ho, Kim Hyun-joong, Kim Bum",7.9,9619,2009
The Forsyte Saga,24,"Drama, Romance","Damian Lewis, Rupert Graves, Gina McKee, Amanda Root",8.1,5395,2002
No Tomorrow,42,"Comedy, Drama, Romance","Joshua Sasse, Tori Anderson, Jonathan Langdon, Sarayu Blue",7.3,4826,2016
Love Advent,27,Action,"Kendall Jenner, Emily Ratajkowski, Bella Hadid, Daisy Lowe",4.2,120,2011
La reina del flow,27,"Drama, Music","Carolina Ramírez, Carlos Torres, Andres Sandoval, Lucho Velasco",7.9,665,2018
Wanderlust,44,Drama,"Toni Collette, Steven Mackintosh, Joe Hurst, ""Emma DArcy""",7.1,4709,2018
Sick Note,22,"Comedy, Crime","Rupert Grint, Nick Frost, Pippa Bennett-Warner, Marama Corlett",6.8,6337,2017
Monster Musume no Iru Nichijou,60,"Animation, Comedy, Fantasy","Junji Majima, Sora Amamiya, Bryson Baugus, Allison L. Sumrall",6.7,1891,2015
Fate/stay night: Unlimited Blade Works,60,"Animation, Action, Fantasy","Mela Lee, Bryce Papenbrook, Noriaki Sugiyama, Kana Ueda",8,6554,2014
Conan,45,"Comedy, Music, Talk-Show","""Conan OBrien"", Andy Richter, Jimmy Vivino and the Basic Cable Band, Jimmy Vivino",8.1,22839,2010
Utopia,60,Comedy,"Rob Sitch, Celia Pacquola, Dave Lawson, Emma-Louise Wilson",8.3,1696,I 20
Z: The Beginning of Everything,45,"Biography, Drama","Christina Ricci, David Hoflin, Kristine Nielsen, David Strathairn",7.1,3747,2015
Being Human,24,"Drama, Fantasy, Horror","Sam Witwer, Meaghan Rath, Sam Huntington, Kristen Hager",7.5,24490,2011
Great News,22,Comedy,"Briga Heelan, Andrea Martin, Adam Campbell, Nicole Richie",7.1,5763,2017
Shades of Blue,44,"Action, Crime, Drama","Jennifer Lopez, Ray Liotta, Drea de Matteo, Dayo Okeniyi",7,9888,2016
The Bachelor,50,"Drama, Game-Show, Reality-TV","Chris Harrison, Brad Womack, Sean Lowe, Ben Higgins",3.2,6526,2002
Okkupert,60,"Drama, Thriller","Henrik Mestad, Ane Dahl Torp, Eldar Skar, Ingeborga Dapkunaite",7.7,8191,2015
The Moment of Truth,45,"Game-Show, Reality-TV","Mark L. Walberg, Angela Donahue, Kris Mohandie, Catherine R. Seldon",5.1,1205,2008
Almost Human,24,"Action, Crime, Drama","Karl Urban, Michael Ealy, Minka Kelly, Mackenzie Crook",8,48246,2013
Umbre,44,"Crime, Drama, Thriller","Serban Pavlu, Maria Obretin, Andreea Vasile, Madalina Craiu",8.8,9162,2014
Gullak,11,"Comedy, Drama, Family","Jameel Khan, Geetanjali Kulkarni, Vaibhav Raj Gupta, Harsh Mayar",9.2,9073,2019
Galavant,30,"Adventure, Comedy, Fantasy","Joshua Sasse, Timothy Omundson, Vinnie Jones, Mallory Jansen",8.1,14426,2015
MythBusters,42,"Documentary, Mystery, Reality-TV","Robert Lee, Jamie Hyneman, Adam Savage, Kari Byron",8.3,50547,2003
Joahamyeon Ullineun,30,"Comedy, Drama, Romance","Kim So-Hyun, Song Kang, Ga-ram Jung, Go Min-Si",7.1,3521,2019
Making It,60,"Comedy, Reality-TV","Amy Poehler, Nick Offerman, Simon Doonan, Dayna Isom Johnson",7.9,1109,2018
The Bletchley Circle,22,"Crime, Drama, Mystery","Rachael Stirling, Julie Graham, Sophie Rundle, Anna Maxwell Martin",7.9,11140,2012
The New Legends of Monkey,26,"Action, Adventure, Comedy","Chai Hansen, Luciane Buchanan, Josh Thomson, Emilie Cocquerel",6.5,3799,2018
Hazbin Hotel,30,"Animation, Comedy, Crime","Jill Harris, Elsie Lovelock, Michael Kovach, Monica Franco",8.1,2659,2019
Sin Senos Sí Hay Paraíso,30,"Action, Crime, Drama","Fabián Ríos, Carolina Gaitan, Majida Issa, Catherine Siachoque",6.7,460,2016
Ninjago,300,"Animation, Action, Adventure","Kelly Metzger, Michael Adamthwaite, Sam Vincent, Vincent Tong",8.1,368,2019
The Detour,45,"Adventure, Comedy","Jason Jones, Natalie Zea, Ashley Gerasimovich, Liam Carroll",7.7,6231,2016
Seeking Sister Wife,15,Reality-TV,"Jeff Alldredge, Sharis Alldredge, Vanessa Alldredge, Ashley Kapri Snowden",4.2,113,2018
Selling Sunset,60,Reality-TV,"Mary Fitzgerald, Chrishell Stause, Brett Oppenheim, Jason Oppenheim",6.3,3555,2019
Chambers,60,"Drama, Fantasy, Horror","Sivan Alyra Rose, Marcus LaVoi, Nicholas Galitzine, Kyanna Simone Simpson",6.5,7650,2019
Whose Line Is It Anyway?,20,"Comedy, Game-Show","Colin Mochrie, Aisha Tyler, Ryan Stiles, Wayne Brady",8.4,7598,2013
Kath & Kim,25,Comedy,"Jane Turner, Gina Riley, Glenn Robbins, Peter Rowsthorn",8.3,3533,2002
She's Gotta Have It,42,Comedy,"DeWanda Wise, Anthony Ramos, Lyriq Bent, Cleo Anthony",6.7,4223,2017
8 Out of 10 Cats Does Countdown,45,"Comedy, Game-Show","Susie Dent, Jimmy Carr, Rachel Riley, John Pohlhammer",8.1,4822,2012
Anazâ,46,"Animation, Drama, Horror","Atsushi Abe, Natsumi Takamori, Tomoaki Maeno, Greg Ayres",7.6,12079,2012
Queens of Mystery,7,"Crime, Drama, Mystery","Julie Graham, Siobhan Redmond, Martin Trenaman, Sarah Woodward",7.4,1057,2019
House of Anubis,25,"Adventure, Drama, Family","Brad Kavanagh, Jade Ramsey, Tasie Lawrence, Eugene Simon",7.4,4445,2011
Bloom,50,"Drama, Mystery, Sci-Fi","Bryan Brown, Phoebe Tonkin, Genevieve Morris, Terry Norris",6.7,1321,2019
Bulletproof,30,"Action, Crime, Drama","Noel Clarke, Ashley Walters, Jason Maza, Lindsey Coulson",6.6,3128,2018
Comedians in Cars Getting Coffee,60,"Animation, Comedy, Family","Jerry Seinfeld, Michael Richards, Mario Joyner, Jimmy Fallon",8.1,11325,2012
Mirai nikki,469,"Animation, Action, Drama","Josh Grelle, Brina Palencia, Leah Clark, Emily Neves",7.6,15040,2011
Murder in the First,30,"Crime, Drama, Mystery","Taye Diggs, Kathleen Robertson, Ian Anthony Dale, Raphael Sbarge",7.3,6767,2014
Jenni Rivera: Mariposa de Barrio,45,"Drama, Musical","Gabriel Porras, Rosalinda Rodríguez, Angélica Celaya, Adrian Carvajal",7.4,201,2017
Gang Related,50,"Action, Crime, Drama","Ramon Rodriguez, Jay Hernandez, RZA, Sung Kang",7.6,5990,2014
Chicken Girls,43,"Comedy, Drama, Family","Hayley LeBlanc, Jules LeBlanc, Brooke Elizabeth Butler, Indiana Massara",6.5,585,2017
Winx Club,60,"Animation, Action, Adventure","Letizia Ciampa, Gemma Donati, ""Domitilla DAmico"", Perla Liberatori",6.1,4596,2004
The Rook,23,"Drama, Fantasy, Sci-Fi","Emma Greenwell, Joely Richardson, Jon Fletcher, Ronan Raftery",6.8,4248,2019
Pawn Stars,60,Reality-TV,"Rick Harrison, Corey Harrison, ""Austin Chumlee Russell"", Richard Harrison",7.2,15584,2009
Republic of Doyle,24,"Comedy, Crime, Drama","Allan Hawco, Krystin Pellerin, ""Mark OBrien"", Marthe Bernard",7.3,3482,2010
Cranford,60,Drama,"Judi Dench, Julia McKenzie, Imelda Staunton, Lisa Dillon",8.3,8794,2007
Game Shakers,60,"Comedy, Family","Cree Cicchino, Madisyn Shipman, Benjamin Flores Jr., Thomas Kuc",4.5,1661,2015
Bard of Blood,22,"Action, Adventure, Drama","Emraan Hashmi, Sobhita Dhulipala, Jaideep Ahlawat, Shishir Sharma",6.9,9240,2019
Hache,30,"Crime, Drama, Thriller","Adriana Ugarte, Eduardo Noriega, Marc Martínez, Pep Ambròs",6.5,1305,2019
God Friended Me,60,"Comedy, Drama, Fantasy","Brandon Micheal Hall, Violett Beane, Suraj Sharma, Javicia Leslie",6.9,6607,2018
"Midnight, Texas",22,"Drama, Fantasy, Mystery","François Arnaud, Dylan Bruce, Parisa Fitz-Henley, Arielle Kebbel",7.4,12753,2017
Light as a Feather,11,"Drama, Horror, Thriller","Liana Liberato, Haley Ramm, Brianne Tju, Jordan Rodrigues",6.6,2993,2018
Hit the Floor,30,"Drama, Romance","Katherine Bailess, McKinley Freeman, ""Jonathan Lil J McDaniel"", Carly Anderson",7.1,2440,2013
Tengen toppa gurren lagann,45,"Animation, Action, Adventure","Yuri Lowenthal, Kana Asumi, Steve Blum, Johnny Yong Bosch",8.3,15357,2007
The Innocents,24,"Drama, Horror, Mystery","Sorcha Groundsell, Percelle Ascott, Guy Pearce, Jóhannes Haukur Jóhannesson",6.3,5351,2018
Between,30,"Drama, Mystery, Sci-Fi","Jennette McCurdy, Jesse Carere, Justin Kelly, Kyle Mac",6,8500,2015
Storage Wars,40,Reality-TV,"Brandi Passante, Jarrod Schulz, Laura Dotson, Dan Dotson",6.3,8991,2010
Better Off Ted,45,"Comedy, Sci-Fi","Jay Harrington, Portia de Rossi, Andrea Anders, Jonathan Slavin",8.2,24966,2009
The Dead Zone,55,"Drama, Fantasy, Mystery","Anthony Michael Hall, Nicole de Boer, Chris Bruno, John L. Adams",7.4,8736,2002
Red Rock,41,"Crime, Drama","Patrick Ryan, Andrea Irvine, David Crowley, Jane McGrath",7.7,747,2015
Estoy vivo,60,"Action, Adventure, Fantasy","Javier Gutiérrez, Alejo Sauras, Fele Martínez, Alfonso Bassave",7.6,846,2017
Metalocalypse,90,"Animation, Comedy, Music","Brendon Small, Tommy Blacha, Mark Hamill, Victor Brandt",8.2,15755,2006
Schooled,24,Comedy,"Tim Meadows, Bryan Callen, AJ Michalka, Brett Dier",6.9,3073,2019
Home Fires,120,"Drama, War","Clare Calbraith, Brian Fletcher, Samantha Bond, Ruth Gemmell",8.2,3336,2015
Ôran kôkô hosutobu,277,"Animation, Comedy, Romance","Maaya Sakamoto, Mamoru Miyano, Masaya Matsukaze, Kenichi Suzumura",8.2,8631,2006
Weird City,24,"Comedy, Sci-Fi","Cynthy Wu, LeVar Burton, Anthony Holiday, Emily Kosloski",6,2086,2019
Ingobernable,30,"Crime, Drama, Mystery","Kate del Castillo, Leah Allers, Eréndira Ibarra, Alberto Guerra",7.2,2801,2017
Der Bergdoktor,60,Drama,"Hans Sigl, Heiko Ruprecht, Monika Baumgartner, Ronja Forcher",6.4,420,2008
Sangsogjadeul,43,"Comedy, Drama, Romance","Lee Min-Ho, Park Shin-Hye, Woo-bin Kim, Kim Ji-Won",7.5,8226,2013
24: Legacy,29,"Action, Crime, Drama","Corey Hawkins, Miranda Otto, Anna Diop, Teddy Sears",6.2,10342,2016
The Amazing Race,5,"Adventure, Family, Game-Show","Phil Keoghan, Joyce Agu, Uchenna Agu, Jet McCoy",7.6,13560,2001
Vienna Blood,30,"Crime, Drama, Mystery","Matthew Beard, Jürgen Maurer, Jessica De Gouw, Charlene McKenna",7.4,3018,2019
Blue's Clues & You!,30,"Animation, Adventure, Comedy","Joshua Dela Cruz, Traci Paige Johnson, Doug Murray, Brad Adamson",6.9,292,2019
Kengan Ashura,225,"Animation, Action","Kaiji Tang, Michael C. Pizzuto, Keith Silverstein, Erika Harlacher",8,3634,2019
Mucize Doktor,23,Drama,"Taner Ölmez, Onur Tuna, Sinem Ünsal, Hazal Türesan",7.1,2273,2019
The Hot Zone,46,"Drama, Sci-Fi, Thriller","Julianna Margulies, Noah Emmerich, Topher Grace, Liam Cunningham",7.3,6255,2019
Owari no serafu,42,"Animation, Action, Adventure","Miyu Irino, Micah Solusod, Saori Hayami, Nobuhiko Okamoto",7.5,4016,2015
Splitting Up Together,30,Comedy,"Jenna Fischer, Oliver Hudson, Olivia Keville, Van Crosby",6.9,3439,2018
Sue Thomas: F.B.Eye,60,"Crime, Drama, Mystery","Deanne Bray, Yannick Bisson, Rick Peters, Marc Gomes",7.3,1875,2002
The Brave,44,"Action, Drama, Thriller","Anne Heche, Mike Vogel, Tate Ellington, Demetrius Grosse",7.6,8493,2017
The Other One,56,Comedy,"Ellie White, Lauren Socha, Siobhan Finneran, Rebecca Front",7.5,876,2017
Breaking Bad: Original Minisodes,45,"Short, Comedy, Crime","Bob Odenkirk, Matt Jones, Aaron Paul, Bryan Cranston",7.9,1207,2009
Flowers,42,"Comedy, Drama","Sophia Di Martino, Olivia Colman, Julian Barratt, Daniel Rigby",8.2,4580,2016
Cartel Crew,30,Reality-TV,"Stephanie Acevedo, Michael Blanco, Dayana Castellanos, Kat Flores",3.5,117,2019
Land Girls,120,Drama,"Becci Gemmell, Susan Cookson, Mark Benton, Mykola Allen",7,2778,2009
The Spectacular Spider-Man,30,"Animation, Action, Adventure","Josh Keaton, Lacey Chabert, Joshua LeBar, Grey Griffin",8.2,11103,2008
Kurt Seyit ve Sura,44,"Drama, History, Romance","Kivanç Tatlitug, Farah Zeynep Abdullah, Caglar Ertugrul, Demet Özdemir",7.2,3163,2014
Powers,23,"Action, Crime, Drama","Sharlto Copley, Susan Heyward, Noah Taylor, Eddie Izzard",6.7,6219,2015
The Worst Witch,55,"Family, Fantasy","Raquel Cassidy, Jenny Richardson, Clare Higgins, Dagny Rollins",7.3,2017,2017
Here and Now,60,"Comedy, Drama, Fantasy","Tim Robbins, Holly Hunter, Daniel Zovatto, Jerrika Hinton",6.8,4516,2018
The Finder,24,"Comedy, Crime, Drama","Geoff Stults, Maddie Hasson, Mercedes Mason, Michael Clarke Duncan",7.7,14914,2012
Soundtrack,120,"Drama, Musical","Paul James, Callie Hernandez, Marianne Jean-Baptiste, Jenna Dewan",6.8,1855,2019
Star Trek Continues,43,"Action, Adventure, Sci-Fi","Vic Mignogna, Todd Haberkorn, Christopher Doohan, Grant Imahara",8,2607,2013
Eyewitness,30,"Crime, Mystery, Romance","Julianne Nicholson, Tyler Young, James Paxton, Gil Bellows",7.7,4846,2016
Disjointed,60,Comedy,"Kathy Bates, Aaron Moten, Elizabeth Alderfer, Tone Bell",6.8,9190,2017
Çarpisma,60,"Action, Drama, Thriller","Kivanç Tatlitug, Elçin Sangu, Alperen Duymaz, Melisa Pamuk",7.6,3490,2018
School of Rock,45,"Comedy, Family, Musical","Breanna Yde, Ricardo Hurtado, Jade Pettyjohn, Lance Lim",4.5,1330,2016
The Real Housewives of Atlanta,11,Reality-TV,"Kandi Burruss, Cynthia Bailey, NeNe Leakes, Kenya Moore",4.3,3347,2008
Fast & Furious Spy Racers,60,"Animation, Action, Crime","Tyler Posey, Charlet Takahashi Chung, Jorge Diaz, Luke Youngblood",5.5,1073,2019
Manhattan,420,"Drama, History, War","Rachel Brosnahan, Michael Chernus, Christopher Denham, Katja Herbers",7.8,7877,2014
W - Du gaeui segye,60,"Drama, Fantasy, Romance","Han Hyo-joo, Lee Jong-Suk, Jeong Eu-Gene, Eui-sung Kim",8.1,7256,2016
Megalo Box,30,"Animation, Action, Adventure","Yoshimasa Hosoya, Michiyo Murase, Shirô Saitô, Hiroki Yasumoto",7.8,2490,2018
Yasak Elma,50,"Drama, Romance","Sevval Sam, Eda Ece, Safak Pekdemir, Baris Aytac",5.7,1358,2018
For the People,50,Drama,"Hope Davis, Ben Shenkman, Jasmin Savoy Brown, Susannah Flood",7.3,5003,2018
A.N.T. Farm,50,"Comedy, Drama, Family","China Anne McClain, Sierra McCormick, Jake Short, Stefanie Scott",5.1,6227,2011
Good Behavior,30,"Crime, Drama, Mystery","Michelle Dockery, Juan Diego Botto, Terry Kinney, Lusia Strus",8.1,9886,2016
Hilleo,13,"Action, Comedy, Crime","Ji Chang-Wook, Park Min-Young, Tae-Mi, Jeong Gyu-Su",8.5,6533,2014
Outrageous Fortune,60,"Comedy, Crime, Drama","Robyn Malcolm, Antony Starr, Siobhan Marshall, Antonia Prebble",8.3,1937,2005
Childrens Hospital,60,Comedy,"Rob Huebel, Rob Corddry, Ken Marino, Erinn Hayes",7.8,7163,2008
Secret Bridesmaids' Business,28,"Drama, Romance, Thriller","Abbie Cornish, Katie McGrath, Georgina Haig, Alexander England",7.2,548,2019
Little Dorrit,30,"Drama, Mystery, Romance","Claire Foy, Matthew Macfadyen, Tom Courtenay, Judy Parfitt",8.2,8908,2008
Shark Tank,30,"Family, Reality-TV","""Kevin OLeary"", Phil Crowley, Mark Cuban, Robert Herjavec",7.6,8799,2009
Uncle,52,Comedy,"Nick Helm, Elliot Speller-Gillott, Daisy Haggard, Daniel Lawrence Taylor",7.9,3476,2012
Rogue,30,"Action, Crime, Drama","Cole Hauser, Thandiwe Newton, Sergio Di Zio, Sarah Jeffery",6.9,2505,2013
Rojst,30,"Crime, Drama, Thriller","Dawid Ogrodnik, Andrzej Seweryn, Zofia Wichlacz, Magdalena Walach",6.9,2867,2018
Impulse,30,"Action, Drama, Sci-Fi","Maddie Hasson, Sarah Desjardins, Enuka Okuma, Craig Arnold",7.4,9193,2018
Bad Education,41,Comedy,"Jack Binstead, Mathew Horne, Ethan Lawrence, Kae Alexander",7.4,10893,2012
RWBY,25,"Animation, Action, Adventure","Lindsay Jones, Kara Eberle, Barbara Dunkelman, Arryn Zech",7.9,5270,2012
How the Universe Works,42,Documentary,"Phil Plait, Michelle Thaller, Mike Rowe, Hakeem Oluseyi",8.9,6179,2010
The Good Karma Hospital,40,Drama,"Amanda Redman, Amrita Acharia, James Krishna Floyd, Darshan Jariwala",7.9,1650,2017
Bored to Death,52,"Comedy, Crime, Drama","Jason Schwartzman, Zach Galifianakis, Ted Danson, Heather Burns",7.9,31862,2009
The Shop,30,Talk-Show,"Maverick Carter, LeBron James, Paul Rivera, Jerrod Carmichael",6.6,808,I 20
Just Tattoo of Us,23,"Comedy, Drama, Reality-TV","Atom, Stephen Bear, Cally-Jo, Charlotte Crosby",3.8,215,2017
Kirgin Çiçekler,23,"Crime, Drama, Romance","Arif Diren, Gökçe Akyildiz, Mehmet Aykaç, Veda Yurtsever Ipek",5.7,788,2015
The Get Down,122,"Drama, Music, Musical","Justice Smith, Shameik Moore, Herizen F. Guardiola, Skylan Brooks",8.3,21337,2016
Stath Lets Flats,60,Comedy,"Jamie Demetriou, Al Roberts, Natasia Demetriou, Kiell Smith-Bynoe",7.6,1671,2018
The Bernie Mac Show,60,"Comedy, Drama, Family","Bernie Mac, Kellita Smith, Jeremy Suarez, Dee Dee Davis",7,7097,2001
Back to Life,52,"Comedy, Drama","Daisy Haggard, Geraldine James, Richard Durden, Liam Williams",7.5,3077,2019
Somewhere Between,43,"Drama, Mystery, Sci-Fi","Paula Patton, Devon Sawa, Aria Birch, Catherine Barroll",6.2,5022,2017
Dead Pixels,30,"Comedy, Fantasy","Alexa Davies, Will Merrick, Charlotte Ritchie, Sargon Yelda",7.4,1919,2019
The Crossing,47,"Adventure, Drama, Sci-Fi","Steve Zahn, Natalie Martinez, Tommy Bastow, Rob Campbell",7.2,9107,2018
Lore,30,"Documentary, Horror, Mystery","Aaron Mahnke, Steven Berkoff, Josh Bowman, Paula Malcomson",6.7,4841,2017
Unité 42,30,"Crime, Drama, Thriller","Patrick Ridremont, Constance Gay, Tom Audenaert, Roda Fawaz",7,1917,2017
Wrecked,60,"Action, Adventure, Comedy","Zach Cregger, Asif Ali, Brian Sacca, Ally Maki",7.3,6556,2016
Drifters,30,Comedy,"Jessica Knappett, Lydia Rose Bewley, ""Lauren ORourke"", Bobby Hirston",7.1,1342,2013
1000 Ways to Die,45,"Documentary, Comedy, Horror","Alisdair Simpson, Ron Perlman, Khyber Zaffarkhan, Boyd Flinders",6.9,3458,2008
Ao Haru Ride,7,"Animation, Comedy, Drama","Yûki Kaji, Tsubasa Honda, Ai Kayano, Masahiro Higashide",7.5,3654,2014
Pasión de Gavilanes,30,"Drama, Romance","Danna García, Paola Rey, Mario Cimarro, Jorge Cao",7.9,2034,2003
Brotherhood,60,"Crime, Drama","Jason Isaacs, Jason Clarke, Annabeth Gish, Kevin Chapman",7.7,6918,2006
Le chalet,nan,"Drama, Mystery, Thriller","Chloé Lambert, Philippe Dusseau, Blanche Veisberg, Eric Savin",7,6213,2017
Tru Calling,nan,"Drama, Fantasy, Mystery","Eliza Dushku, Shawn Reaves, Zach Galifianakis, A.J. Cook",7.4,15614,2003
Top Coppers,nan,Comedy,"John Kearns, Steen Raskopoulos, Donovan Blackwood, Gabby Best",6.3,211,2015
The Almighty Johnsons,nan,"Comedy, Drama, Fantasy","Emmett Skilton, Timothy Balme, ""Dean OGorman"", Jared Turner",8.2,4334,2011
If Loving You Is Wrong,nan,"Drama, Romance","Edwina Findley, Heather Hemmens, April Parker Jones, Aiden Turner",5.8,1202,2014
The Mighty Boosh,nan,"Comedy, Fantasy, Musical","Julian Barratt, Noel Fielding, Michael Fielding, Rich Fulcher",8.3,20824,2003
Expedition Unknown,nan,"Adventure, Mystery, Reality-TV","Josh Gates, Tony Sam, Evan B. Stone, Brian C. Weed",8.2,2451,2015
Femme Fatales,nan,"Crime, Drama, Mystery","Tanit Phoenix, Catherine Annette, Ellie Cornell, Christine Donlon",6,1461,2011
Rebecka Martinsson,nan,"Crime, Drama, Mystery","Eva Melander, Jakob Öhrman, Ardalan Esmaili, Thomas Oredsson",7.2,2294,2017
Hey Duggee,nan,"Animation, Family","Alexander Armstrong, Jasmine Bartholomew, Alfie Sanderson, Poppie Boyes",8.9,846,2014
College Romance,nan,"Comedy, Drama, Romance","Manjot Singh, Apoorva Arora, Keshav Sadhna, Gagan Arora",8.9,24230,2018
Whiskey Cavalier,nan,"Action, Adventure, Comedy","Scott Foley, Lauren Cohan, Ana Ortiz, Tyler James Williams",7.1,8531,2019
Life Below Zero,44,"Documentary, Adventure, Reality-TV","James Franzo, Sue Aikens, Agnes Hailstone, Chip Hailstone",8,1633,2013
Made in Abyss,325,"Animation, Adventure, Drama","Miyu Tomita, Mariya Ise, Luci Christian, Brittany Lauda",8.4,7086,2017
Kadin,120,Drama,"Özge Özpirinçci, Seray Kaya, Kubra Suzgun, Ali Semi Sefil",6.7,1026,2017
The Arrangement,60,Drama,"Josh Henderson, Christine Evangelista, Lexa Doig, Carra Patterson",6.6,3169,I 20
El internado,75,"Drama, Mystery, Thriller","Marta Torné, Martiño Rivas, Raúl Fernández de Pablo, Yon González",8.2,4552,2007
Il giovane Montalbano,120,"Crime, Mystery","Andrea Tidona, Michele Riondino, Fabrizio Pizzuto, Alessio Piazza",7.7,1182,2012
Human Target,60,"Action, Adventure, Crime","Mark Valley, Chi McBride, Jackie Earle Haley, Indira Varma",7.7,17434,2010
Wilfred,22,"Comedy, Drama, Mystery","Elijah Wood, Jason Gann, Fiona Gubelmann, Dorian Brown Pham",7.8,40422,2011
Secrets and Lies,43,"Crime, Drama","Ryan Phillippe, Juliette Lewis, KaDee Strickland, Natalie Martinez",7.6,10657,2015
The Grim Adventures of Billy & Mandy,30,"Animation, Adventure, Comedy","Greg Eagles, Richard Steven Horvitz, Grey Griffin, Vanessa Marshall",7.7,21243,2001
R.L. Stine's The Haunting Hour,23,"Action, Adventure, Drama","Jeny Cassady, Dan Payne, Emma Grabinsky, Geoff Redknap",7.9,2219,2010
Indian Summers,52,Drama,"Henry Lloyd-Hughes, Jemima West, Julie Walters, Rick Warden",7.3,3730,2015
Christina on the Coast,30,Reality-TV,"Christina Anstead, Cassie Zebisch, Ant Anstead, Walter Buttkus Iii",3.6,420,2019
Ao no ekusoshisuto,30,"Animation, Action, Drama","Nobuhiko Okamoto, Bryce Papenbrook, Jun Fukuyama, Johnny Yong Bosch",7.5,11498,2011
Club de Cuervos,40,"Comedy, Drama","Luis Gerardo Méndez, Mariana Treviño, Jesús Zavala, Antonio de la Vega",8.2,5099,2015
Leonning maen,80,"Comedy, Game-Show, Reality-TV","Jae-Suk Yoo, Jong-Kook Kim, Haha, Kwang-Soo Lee",9,2715,2010
Evil Lives Here,43,"Documentary, Biography, Crime","T.J. Craig, Robert Levey II, Brian Vadim, David Wenzel",8,841,2016
"What's New, Scooby-Doo?",30,"Animation, Adventure, Comedy","Frank Welker, Mindy Cohn, Casey Kasem, Arturo Mercado",7.3,8342,2002
Girlboss,26,Comedy,"Britt Robertson, Ellie Reed, Johnny Simmons, Alphonso McAuley",7,16013,2017
Mountain Men,42,"Reality-TV, Western","Tom Oar, Eustace Conway, D.B. Sweeney, Marty Meierotto",7.3,1360,2012
Out of Love,50,Thriller,"Rasika Dugal, Purab Kohli, Suhaas Ahuja, Harsh Chhaya",7.1,1062,2019
Autopsy: The Last Hours of,45,"Documentary, Biography","Michael Hunter, Eric Meyers, Linda Papadopoulos, Iain Glen",7.7,570,2014
Behzat Ç.: Bir Ankara Polisiyesi,90,"Crime, Drama, Mystery","Erdal Besikçioglu, Inanç Konukçu, Ege Aydan, Berkan Sal",8.8,28077,2010
Phil of the Future,25,"Adventure, Comedy, Family","Raviv Ullman, Amy Bruckner, Craig Anton, Lise Simms",7,7026,2004
Togetherness,30,"Comedy, Drama, Romance","Mark Duplass, Melanie Lynskey, Amanda Peet, Steve Zissis",7.5,7784,2015
Stitchers,60,"Crime, Drama, Sci-Fi","Emma Ishta, Kyle Harris, Ritesh Rajan, Salli Richardson-Whitfield",6.9,11553,2015
The Looney Tunes Show,23,"Animation, Short, Adventure","Jeff Bergman, Bob Bergen, Fred Armisen, Kristen Wiig",7.5,9083,2011
The Listener,42,"Crime, Drama, Fantasy","Craig Olejnik, Ennis Esmer, Lauren Lee Smith, Rainbow Sun Francks",6.8,7786,2009
Count Arthur Strong,30,Comedy,"Steve Delaney, Rory Kinnear, Zahra Ahmadi, Andy Linden",7.6,774,2013
Charité,45,"Drama, History","Alicia von Rittberg, Mala Emde, Nina Gummich, Maximilian Meyer-Bretschneider",7.9,2800,2017
Carmen Sandiego,22,"Animation, Action, Adventure","Finn Wolfhard, Gina Rodriguez, ""Liam OBrien"", Abby Trott",7.9,4619,2019
L'art du crime,50,"Crime, Drama, Mystery","Nicolas Gob, Eléonore Bernheim, Benjamin Egner, Philippe Duclos",7,356,2017
The Late Late Show with James Corden,60,"Comedy, Talk-Show","James Corden, Reggie Watts, Louis Waymouth, Allison Janney",6.1,6511,2015
Informer,60,"Crime, Drama, Thriller","Paddy Considine, Nabhaan Rizwan, Bel Powley, Reiss Jeram",7.8,4977,2018
Green Wing,65,"Comedy, Drama","Sally Bretton, Oliver Chris, Olivia Colman, Michelle Gomez",8.3,11316,2004
"Nuevo rico, nuevo pobre",50,Comedy,"Martín Karpan, Carolina Acevedo, Jhon Álex Toro, María Cecilia Botero",7.2,97,2007
Beulraek,360,"Crime, Drama, Fantasy","Song Seung-heon, Go Ara, Lee El, Jo Jae-yoon",8,2995,2017
Bakemonogatari,185,"Animation, Action, Comedy","Hiroshi Kamiya, Eri Kitamura, Yuka Iguchi, Chiwa Saitô",8,4614,2009
Judge John Deed,24,"Crime, Drama, Mystery","Martin Shaw, Jenny Seagrove, Barbara Thorn, Simon Chandler",7.6,1030,2001
Kaichou wa meido-sama!,90,"Animation, Comedy, Romance","David Matranga, Monica Rial, Ayumi Fujimura, Nobuhiko Okamoto",8,5723,2010
Ask-i Memnu,60,"Drama, Romance","Beren Saat, Kivanç Tatlitug, Nebahat Çehre, Hazal Kaya",7.4,12095,2008
Roadies,60,"Comedy, Drama, Music","Carla Gugino, Luke Wilson, Imogen Poots, Rafe Spall",7.4,5291,2016
Last Resort,22,"Action, Drama, Mystery","Andre Braugher, Scott Speedman, Daisy Betts, Camille De Pazzis",7.4,21120,I 20
Undeclared,10,Comedy,"Jay Baruchel, Carla Gallo, Charlie Hunnam, Monica Keena",7.9,16416,2001
State of the Union,56,"Short, Comedy, Drama","""Chris ODowd"", Rosamund Pike, Patricia Clarkson, Brendan Gleeson",7.9,4308,2019
Boss,45,"Crime, Drama","Kelsey Grammer, Connie Nielsen, Hannah Ware, Jeff Hephner",8.1,17165,2011
Wolf Creek,30,"Horror, Thriller","John Jarratt, Lucy Fry, Dustin Clare, Tess Haubrich",7.2,4473,2016
The Avengers: Earth's Mightiest Heroes,30,"Animation, Action, Adventure","Eric Loomis, ""Colleen OShaughnessey"", Brian Bloom, Rick D. Wasserman",8.3,13468,2010
The Windsors,30,Comedy,"Celeste Dring, Louise Ford, Hugh Skinner, Ellie White",7.1,2318,2016
Forever,43,"Comedy, Drama, Fantasy","Maya Rudolph, Fred Armisen, Catherine Keener, Noah Robbins",7.2,5671,I 20
Touch,44,"Drama, Mystery, Sci-Fi","Kiefer Sutherland, David Mazouz, Gugu Mbatha-Raw, Lukas Haas",7.3,41835,2012
Spider-Man,60,"Animation, Action, Adventure","Robbie Daymond, Nadji Jeter, Fred Tatasciore, Laura Bailey",6.1,1930,2017
Saving Grace,30,"Drama, Fantasy","Holly Hunter, Leon Rippy, Kenny Johnson, Bailey Chase",7.6,4651,2007
Work in Progress,45,Comedy,"Abby McEnany, Karin Anglin, Celeste Pechous, Julia Sweeney",7.3,1329,II 2
Dark Heart,16,"Crime, Drama, Thriller","Tom Riley, Joseph Teague, Anjli Mohindra, Charlotte Riley",6.6,1286,2016
Little Things,60,"Comedy, Romance","Dhruv Sehgal, Mithila Palkar, Abhishek Bhalerao, Rishi Deshpande",8.3,4810,2016
